0,LGBTQ+ Hangout 2 CSGO Clan Tag Style Name,http://www.mediafire.com/file/doz8hbghwfcwenp/file
119,Build A Boat UPLOAD ANY IMAGE [FREE],http://www.mediafire.com/file/3lso5lx5z8n3oyg/Build_A_Boat_UPLOAD_ANY_IMAGE_%255BFREE%255D.txt/file
120,Nemesis Hub CRACKED,http://www.mediafire.com/file/b963510p6pa7sm8/Nemesis_Hub_CRACKED.txt/file
121,Blockverse GUI V1,http://www.mediafire.com/file/u8vhuebunbmqou9/Blockverse_GUI_V1.txt/file
122,Blockverse KILL AURA [WORKS FOR OTHER MC CLONES],http://www.mediafire.com/file/47mzedg8dz1szel/Blockverse_KILL_AURA.txt/file
123,Blacksite Zeta ANTI TURRET DAMAGE,http://www.mediafire.com/file/05tgv7yozduh2g0/Blacksite_Zeta_ANTI_TURRET_DAMAGE.txt/file
124,Room 2 LOOP KILL ALL,http://www.mediafire.com/file/basxkl1u5iduacn/Room_2_LOOP_KILL_ALL.txt/file
125,Bee Swarm Simulator AUTO COMPLETE THE HOW TO PROGRAM BASIC BOOK EVENT,http://www.mediafire.com/file/lqxpow8rt0oz1i1/Bee_Swarm_Simulator_AUTO_COMPLETE_EVENT.txt/file
126,Rocitizens FOOD SPAWNER,http://www.mediafire.com/file/39uo1lko3c44nii/Rocitizens_FOOD_SPAWNER.txt/file
127,Adopt Me AUTO FARM [OPEN SOURCE],http://www.mediafire.com/file/hiwdoujpt2rccqq/Adopt_Me_AUTO_FARM_%255BOPEN_SOURCE%255D.txt/file
128,Build A Boat For Treasure INFINITE BLOCKS,http://www.mediafire.com/file/kg5xf02jia577dk/Build_A_Boat_INFINITE_BLOCKS.txt/file
129,IMAGINE ALL SKINS & INFINITE MONEY,http://www.mediafire.com/file/l0rbakn3txj7u9d/IMAGINE_ALL_SKINS.txt/file
130,"Grand Piece Online GUI AUTO FARM BARRELS, AUTO FARM CHESTS & MORE!",http://www.mediafire.com/file/qomtyiogdnjy8s1/Grand_Piece_Online_GUI_AUTO_FARM_BARRLES%252C__CHESTS_%2526_MORE%2521.txt/file
131,Project: One Piece NEW AUTO FARM GUI,http://www.mediafire.com/file/obp420a13c35s3y/Project_One_Piece_NEW_AUTO_FARM_GUI.txt/file
132,"Blox Fruits GUI, BYPASSED BAN AUTO FARM & MORE!",http://www.mediafire.com/file/05ysdsjcx6ki8f5/Blox_Fruits_GUI_BAN_BYPASS_AUTO_FARM_%2526_MORE%2521.txt/file
133,"IMAGINE GUI, UNLOCK ALL SKINS, AUTO FARM & MORE!",http://www.mediafire.com/file/uswbyo5p61hfq2l/IMAGINE_GUI%252C_UNLOCK_ALL_SKINS%252C_AUTO_FARM_%2526_MORE%2521.txt/file
134,ROBLOX CHEATBLOX CONSOLE SCRIPT,http://www.mediafire.com/file/shut5e64z1a84cr/ROBLOX_CHEATBLOX_CONSOLE_SCRIPT.txt/file
135,Bjkefe Hub FREE SCRIPT HUB [5 GAMES],http://www.mediafire.com/file/98g8c7t6u6aa0zg/Bjkefe_Hub_FREE_SCRIPT_HUB_%255B5_GAMES%255D.txt/file
136,Road to Gramby AIMBOT & ESP [SYN X ONLY],http://www.mediafire.com/file/cbsku2bj895dyfx/Road_To_Grambys_ESP.txt/file
137,Arsenal DECEMBER SILENT AIM [OPEN SOURCE],http://www.mediafire.com/file/a9byiwbxllcl228/Arsenal_DECEMBER_SILENT_AIM_2020.txt/file
138,Mad City ONLY WORKING AUTO ROB OUT RIGHT NOW [FAST],http://www.mediafire.com/file/qo1qego98iz6glu/Mad_City_ONLY_WORKING_AUTO_ROB_OUT_NOW.txt/file
139,Natural Disaster Survival AUTO CHAT DISASTER [GOOD FOR TROLLING],http://www.mediafire.com/file/3zud4uoexb59ybl/Natural_Disaster_Survival_AUTO_CHAT_DISASTER.txt/file
140,Infectious Smile LOOP KILL ALL,http://www.mediafire.com/file/uk9q2t0i41kysww/Infectious_Smile_LOOP_KILL_ALL.txt/file
141,MINECRAFT 5 DELETE THE MAP SCRIPT,http://www.mediafire.com/file/6uvoddjx8cy4o5j/Minecraft_5_MAP_DELETER.txt/file
142,Talent Game [RGT] AUTO FARM V2,http://www.mediafire.com/file/kth48zoa0k4y5pg/Talent_Game_%255BRGT%255D_AUTO_FARM_V2.txt/file
143,Breaking Point AUTO SHOOT,http://www.mediafire.com/file/07u596g8cm1ck0s/Breaking_Point_AUTO_SHOOT.txt/file
144,Pacifico 2: Playground Town VEHICLE SPEED SCRIPT,http://www.mediafire.com/file/olzmlzp3hpjtljm/Pacifico_2_Playground_Town_VEHICLE_SPEED_SCRIPT.txt/file
145,"Roanoke, VA MONEY AUTO FARM [DECEMBER]",http://www.mediafire.com/file/4v4be2szrfaktxa/Roanoke%252C_VA_MONEY_AUTO_FARM.txt/file
146,RoCitizens FOOD SPAWNER & DUPER,http://www.mediafire.com/file/elkp57hb522zv12/RoCitizens_NEW_FOOD_SPAWNER.txt/file
147,Mega Noob Simulator COINS FARM,http://www.mediafire.com/file/omduup1lrapweg3/Mega_Noob_Sim_COINS_FARM.txt/file
148,World of Magic INSTANT DAMAGE SCRIPT,http://www.mediafire.com/file/f7p5e2rv7gf449o/World_of_Magic_INSTANT_DAMAGE_SCRIPT.txt/file
149,The HORROR Mansion GUI,http://www.mediafire.com/file/s5shby2eiyw1s0b/The_HORROR_Mansion_GUI.txt/file
150,Project One Piece GUI,http://www.mediafire.com/file/p2cqfnjdz3o670q/Project_One_Piece_GUI.txt/file
151,Bubble Gum Simulator AUTO PRESENTS,http://www.mediafire.com/file/dxo4b0p7aqqa5gh/Bubble_Gum_Sim_AUTO_PRESENTS.txt/file
152,Wonder Woman: The Themyscira Experience OP SCRIPT,http://www.mediafire.com/file/7kzq9eceb3d7033/Wonder_Woman_GUI.txt/file
153,Phantom Forces CLICK TP,https://www.mediafire.com/file/f9jceafyz8k5v7a/Phantom_Forces_CLICK_TP.txt/file
154,Rogue Lineage TEMPLE OF FIRE AUTO FARM,https://www.mediafire.com/file/xoglrfji2tufh97/Rogue_Lineage_TEMPLE_OF_FIRE_AUTO_FARM.txt/file
155,Electric State GUI DECEMBER 2020,https://www.mediafire.com/file/by61v9qroidui72/Electric_State_GUI_DECEMBER_2020.txt/file
156,Driving Empire AUTO FARM,https://www.mediafire.com/file/645b0xffuao6igs/Driving_Empire_AUTO_FARM.txt/file
157,Attack on Titan: Freedom Awaits AUTO STRUGGLE,https://www.mediafire.com/file/damkgj3xes8ngus/AOT_Freedom_Awaits_AUTO_STRUGGLE.txt/file
158,Attack on Titan: Freedom Awaits TITLE CHANGER & MORE!,https://www.mediafire.com/file/f35yw60llz1izel/AOT_Freedom_Awaits_BLOODLINE_CHANGER.txt/filehttps://www.mediafire.com/file/f35yw60llz1izel/AOT_Freedom_Awaits_BLOODLINE_CHANGER.txt/file
159,RoVille POLICE AUTO FARM,https://www.mediafire.com/file/bl4oc02eobxw6sf/RoVille_POLICE_AUTO_FARM.txt/file
160,Bad Business OPERATION UNIVORN PLACE INSTANT [OPEN SOURCE],https://www.mediafire.com/file/9dkuycn627yjjlb/Bad_Business_OPERATION_UNICORN_PLACE_INSTANT.txt/file
161,State of Anarchy BITCHWARE GUI,https://www.mediafire.com/file/cu77ol00oja9yyj/State_Of_Anarchy_BITCHWARE_GUI.txt/file
162,Blacksite Zeta GUN MOD,https://www.mediafire.com/file/n9f04wl0t0duspa/Blacksite_Zeta_GUN_MOD.txt/file
163,Booga Booga BOOGA X NEW OP GUI,https://www.mediafire.com/file/x6ytmvq7cje6j2h/Booga_Booga_BOOGA_X_GUI.txt/file
164,"Wormface AUTO FARM, REBIRTH [OPEN SOURCE]",https://www.mediafire.com/file/lf4xc5h7ee6z2ut/Wormface_AUTO_FARM%252C_REBIRTH_%255BOPEN_SOURCE%255D.txt/file
165,Your Bizarre Adventure ITEM AUTO FARM,https://www.mediafire.com/file/i3u5oy6y0awctjl/Your_Bizarre_Adventure_ITEM_AUTO_FARM.txt/file
166,Infectious Smile KILL PLAYERS,https://www.mediafire.com/file/gvt2u6egn7nsr0p/Infectious_Smile_KILL_PLAYERS_LOOPED.txt/file
167,Gods Of Glory INFINITE MANA,https://www.mediafire.com/file/am1c3ojhqfwvmab/Gods_Of_Glory_INFINITE_MANA.txt/file
168,Elemental Grind Game ELEMENT/LEVEL FARM,https://www.mediafire.com/file/q01633jix5l7xeu/Elemental_Grind_Game_ELEMENT%252CLEVEL_FARM.txt/file
169,Pushing Simulator DESTROYER GUI,https://www.mediafire.com/file/4pys0knopju70se/Pushing_Simulator_DESTROYER_GUI.txt/file
170,Long Neck Testing SERVERSIDED BTOOLS & MORE!,https://www.mediafire.com/file/w65nrmyzfkq0fb9/Long_Neck_Testing_GUI%252C_SERVERSIDED_FEATURES.txt/file
171,Site Bravo GUI OP,https://www.mediafire.com/file/74u5v51gvyz5mhr/Site_Bravo_GUI_OP.txt/file
172,Attack on Titan: Freedom Awaits KILL AURA,https://www.mediafire.com/file/yye1hefp1pkbl9h/AOT_Freedom_Awaits_KILL_AURA.txt/file
173,"Garfield Hub 11 GAMES, MORE SOON [FREE HUB] [OP]",https://www.mediafire.com/file/gk2g6ssan49vsvy/Garfield_Hub_FREE_SCRIPT_HUB.txt/file
174,Zombie Strike OP NPC FARM [OPEN SOURCE],https://www.mediafire.com/file/ykufxhdi2nykspb/Zombie_Strike_OP_NPC_FARM_%255BOPEN_SOURCE%255D.txt/file
175,Redwood Prison GREENIFY MAP,https://www.mediafire.com/file/o9savc5w0gqzu8x/Redwood_Prison_GREENIFY_MAP.txt/file
176,Saber Simulator CANDY CANE AUTO FARM [OPEN SOURCE],https://www.mediafire.com/file/582emz01pj1wns4/Saber_Sim_CANDY_CANE_AUTO_FARM.txt/file
177,Attack On Titan: Freedom Awaits ANTI GRAB,https://www.mediafire.com/file/hpxohs9i5419yn8/AOT_Freedom_Awaits_ANTI_GRAB.txt/file
178,Bubble Gum Sim TIME PLAYED & EGGS OPENED GUI,https://www.mediafire.com/file/vo1t0nm1aehjr70/Bubble_Gum_Sim_TIME_PLAYED_%2526_EGGS_OPENED_GUI.txt/file
179,Attack On Titan: Freedom Awaits TITAN ESP GUI,https://www.mediafire.com/file/783uozk6h16trm1/AOT_Freedp%252C_Awaots_TITAN_ESP_GUI.txt/file
180,RB Battles FINAL BOSS EVENT SCRIPTS,
181,Anomic ANTI CHEAT BYPASS [OPEN SOURCE],https://www.mediafire.com/file/pl25cqjebegd3ow/Anomic_ANTI_CHEAT_BYPASS_%255BOPEN_SOURCE%255D.txt/file
182,Clicking Sim 2.0 GUI,https://www.mediafire.com/file/ko335eofsjmgej8/Clicking_Sim_2.0_GUI.txt/file
183,Attack On Titan: Freedom Awaits BLOODLINE / EYE CHANGERS GUI,https://www.mediafire.com/file/y2wju42g6o14rem/AOT_Freedom__Awaits_BLOODLINE__EYE_CHANGERS_GUI.txt/file
184,Bitcoin Miner INFINITE MONEY,https://www.mediafire.com/file/qz4n9n8sgk6cfoi/Bitcoin_Miner_INFINITE_MONEY.txt/file
185,Mega Easy Obby AUTO COMPLETE & AUTO PRESTIGE,https://www.mediafire.com/file/8gbsk3z53d5zlz4/Mega_Easy_Lobby_AUTO_PRESTIGE.txt/file
186,Infection GUN MODS,https://www.mediafire.com/file/7ctifg0r2d17ftt/Infection_GUN_MODS.txt/file
187,PolyBattle GRENADE TP SCRIPT,https://www.mediafire.com/file/u8kez7guyeuqy5s/PolyBattle_GRENADE_TP.txt/file
188,Wisteria FREE GUI DECEMBER 2020,https://www.mediafire.com/file/6w8sfs0t0j2e4q4/Wisteria_FREE_GUI_DECEMBER_2020.txt/file
189,Electric State DarkRP UPDATED AUTO FARM,https://www.mediafire.com/file/enj2dj20kjk537y/Electric_State_DarkRP_UPDATED_AUTO_FARM.txt/file
190,World Zero KILL AURA,https://www.mediafire.com/file/kvxk8oh82jc1cr2/World_Zero_KILL_AURA.txt/file
191,Dragon Ball Final Remastered AUTO FARM [OPEN SOURCE],https://www.mediafire.com/file/1cq15tg7g6di07k/Dragon_Ball_Final_Remastered_AUTO_FARM_%255BOPEN_SOURCE%255D.txt/file
192,Cube Piece OPEN ALL CHESTS,https://www.mediafire.com/file/g9adaflftc9oz10/Cube_Piece_OPEN_ALL_CHESTS.txt/file
193,Saiyan Fighting Simulator GUI AUTO FARM & MORE!,https://www.mediafire.com/file/9r1g2gs8kwazq47/Saiyan_Fighting_Sim_AUTO_FARM_GUI_WITH_NICE_FEATURES.txt/file
194,AoT Downfall KILL AURA [TITANS],https://www.mediafire.com/file/e8fb61q7oxzjeng/AOT_Downfall_KILL_AURA_FOR_TITAN.txt/file
195,Be Dead Forever Simulator BECOME A CORPSE COPY OF SOMEONE,https://www.mediafire.com/file/br4wu3uk29oyrhl/Be_Dead_Forever_Sim_BECOME_A_DEAD_CLONE_OF_A_PLAYER.txt/file
196,Cube Piece FRUIT TP,https://www.mediafire.com/file/mvrocm7sg07ocnh/Cube_Piece_FRUIT_TP.txt/file
197,IMAGINE MONEY GIVER & UNLOCK ALL OUTFITS,https://www.mediafire.com/file/zdlg3y9bp4yah0e/IMAGINE_MONEY_GIVER_%2526_UNLOCK_ALL_OUTFITS.txt/file
198,Cube Piece AUTO FARM & FRUIT SNIPER,https://www.mediafire.com/file/s0y2kycxd4o6zr3/Cube_Piece_AUTO_FARM%252C_FRUIT_SNIPER.txt/file
199,Cube Piece AUTO FARM & AUTO QUEST [OPEN SOURCE],https://www.mediafire.com/file/ymphiespf1ewqbw/Cube_Piece_AUTO_FARM_%2526_AUTO_QUEST_%255BOPEN_SOURCE%255D.txt/file
200,Anomic OPEN ALL DOORS,https://www.mediafire.com/file/a2ts7rx4jjr7lgd/Anomic_OPEN_ALL_DOORS.txt/file
201,Bloxburg SNOWMAN AUTO FARM,https://www.mediafire.com/file/0s67usb4kupgqae/Bloxburg_SNOWMAN_AUTO_FARM.txt/file
202,Ro-Bio: Improved 2 GAS EVERYONE SCRIPT,https://www.mediafire.com/file/jufo2lmc8c730ba/Ro_Bio_Improved_2_GAS_EVERYONE_SCRIPT.txt/file
203,"Bloxburg AUTO FARM, STYLEZ HAIR STUDIO",https://www.mediafire.com/file/tn2dblcba4zc0r8/Bloxburg_AUTO_FARM_%255BSTYLEZ_HAIR_STUDIO%255D.txt/file
204,Swordburst 2 KILL AURA & DAMAGE MULTIPLIER,https://www.mediafire.com/file/rklrs1emgp1n13w/Swordburst_2_KILL_AURA_%2526_DAMAGE_MULTIPLIER.txt/file
205,"Death Zone AIMBOT, GUN MODS & MORE!",https://www.mediafire.com/file/9et415kgdki6xfl/Death_Zone_AIMBOT%252C_GUN_MODS_%2526_MORE%2521.txt/file
206,"Dragon Ball Future Online GUI LEVEL, ZENI & DRAGON BALL FARM",https://www.mediafire.com/file/7vbvm5sf3xwsctq/Dragon_Ball_Future_Online_GUI.txt/file
207,Tropical Resort Tycoon OBBY AUTO FARM,https://www.mediafire.com/file/0qcyqvwi0gqapti/Tropical_Resort_Tycoon_OBBY_AUTO_FARM.txt/file
208,Dragon Ball Warriors AUTO FARM,https://www.mediafire.com/file/h24vpevjfc23p7t/Dragon_Ball_Warriors_AUTO_FARM.txt/file
209,Blox Life CHILD SPAM & ANNOY ALL,https://www.mediafire.com/file/bl6z5s6xgtmk4k7/Blox_Life_CHILD_SPAM.txt/file
210,Shade’s Wrapper FULL SOURCE,https://www.mediafire.com/file/rvhsklpkae16v24/PerfectWrapper.rar/file
211,AoT Downfall SERVER BREAKER,https://www.mediafire.com/file/nvigrxakuvk7vgd/AoT_Downfall_SERVER_BREAKER.txt/file
212,ROBLOX EXPLOITER CHAT,https://www.mediafire.com/file/jhm3e8s3kp3955m/ROBLOX_EXPLOITER_CHAT.txt/file
213,Wisteria MULTIPLY CONTRIBUTION REWARDS,https://www.mediafire.com/file/avfr7j2vhxs2reb/Wisteria_MULTIPLY_CONTRIBUTION_REWARDS.txt/file
214,Unc0vered SCRIPT HUB [4 GAMES],https://www.mediafire.com/file/14274kety2n1x2c/Unc0vered_SCRIPT_HUB.txt/file
215,Dragon Ball Warriors EQUIP ANY FORM,https://www.mediafire.com/file/51lcv34pzx58iz8/Dragon_Ball_Warriors_EQUIP_ANY_FORM.txt/file
216,"Wisteria AUTO FARM, AUTO HOP",https://www.mediafire.com/file/1d79fod2qsu5wwa/Wisteria_AUTO_FARM%252C_AUTO_HOP.txt/file
217,Sorcerer Fighting Simulator AUTO FARM GUI WITH TELEPORTS,https://www.mediafire.com/file/gdsta5n7rk3rlji/Sorcerer_Fighting_Sim_GUI_AUTO_FARM_%2526_TP.txt/file
218,Strucid AUTO BUILD [OPEN SOURCE],https://www.mediafire.com/file/ckb6vkj6cf7j01y/Strucid_AUTO_BUILD_%255BOPEN_SOURCE%255D.txt/file
219,Venti Cafe ANTI CHEAT BYPASS,https://www.mediafire.com/file/xiupi9sa77f9xmc/Venti_Cafe_ANTI_CHEAT_BYPASS.txt/file
220,Adopt Me WINTER EVENT FARM,
221,VoxlBlade v000 AUTO FARM GUI,https://www.mediafire.com/file/2a1c7t51n9kekep/VoxlBlade_v000_AUTO_FARM_GUI.txt/file
222,"Roblox Trade Bot V1 ANTI PROJECTED, PROJECTED FLIPPER & MORE! [FREE]",https://cdn.discordapp.com/attachments/789015462272434176/789019118627323935/TradeBot_v1.rar
223,Gods of Glory RELIC SCRIPT,https://www.mediafire.com/file/nb07yhhx96thk3r/Gods_of_Glory_RELIC_SCRIPT.txt/file
224,LAUNCH ROBLOX CLOSED BETA CLIENT WITHOUT ACCESS,
225,Slamming Simulator GUI,https://www.mediafire.com/file/687n9rghojtssi8/Slamming_Sim_GUI.txt/file
226,Dust: Wasteland Survival NO RECOIL,https://www.mediafire.com/file/l4nacjw2oajxsxq/Dust_Wasteland_Survival_NO_RECOIL_DECEMBER.txt/file
227,Nations AUTO FARM,https://www.mediafire.com/file/ps0sfkj0dr5iq0z/Nations_AUTO_FARM.txt/file
228,VoxlBlade v000 AUTO FARM NEW,https://www.mediafire.com/file/d0omymuw4oyh5v7/VoxlBlade_v000_AUTO_FARM_NEW.txt/file
229,Wolves’ Life 3 AESTHETIX GUI [GOOD FOR TROLLING],https://www.mediafire.com/file/5plgmr8u11b4s5k/Wolves_Life_3_GUI.txt/file
230,Tank Warfare KILL AURA & GOD MODE [OPEN SOURCE],https://www.mediafire.com/file/im4m292bnavbh0d/Tank_Warfare_GOD_MODE.txt/file
231,Adopt Me GINGERBREAD FARM [OPEN SOURCE],https://www.mediafire.com/file/fe9fdvj98jerk2i/Adopt_Me_GINGERBREAD_FARM_%255BOPEN_SOURCE%255D.txt/file
232,AoT Downfall AUTO FARM,https://www.mediafire.com/file/zkni0y4qkcpchjs/AoT_Downfall_AUTO_FARM.txt/file
233,Island Royale ISLAND RXY4LE ANTI CHEAT BYPASS,https://www.mediafire.com/file/iu48loixmsq58hs/Island_Royale_ISLAND_RXY4LE_ANTI_CHEAT_BYPASS.txt/file
234,Tataki ANCIENT BOOK FARM & ESP [SERVER HOP],https://www.mediafire.com/file/si396ejw5sjucr5/Tataki_ANCIENT_BOOK_FARM.txt/file
235,Arsenal WALKSPEED DECEMBER,https://www.mediafire.com/file/b85jubaql86czvp/Arsenal_WALKSPEED_DECEMBER.txt/file
236,"Tower of Hell GOD MODE, ANTI CHEAT BYPASS & MORE!",
237,"Tetragon Fortress AIMBOT, GOD MODE & FLY",https://www.mediafire.com/file/yp43be7i69ygx2p/Tetragon_Fortress_AIMBOT_%252C_GOD_MODE_%2526_FLY.txt/file
238,"The Streets BREAK EVERYONES GUNS,MELEE AND STAMINA",https://www.mediafire.com/file/dkz1krv88r8z6wo/The_Streets_BREAK_EVERYONES_STAMINA%252C_GUNS_%2526_MELEE.txt/file
239,Anomic KILL ALL,https://www.mediafire.com/file/dtz4sf80zdvb7pn/Anomic_KILL_ALL.txt/file
240,Murder Mystery 2 SHERRIF AND MURDERER DETECTOR SCRIPT,https://www.mediafire.com/file/mlwp07bgd28mwnj/Murder_Mystery_2_SHERRIF_AND_MURDERER_DETECTOR.txt/file
241,Killy V1 KILL ALL ON ANY ACS GAME [GAME DETECTION],https://www.mediafire.com/file/dpmf9ht54p6h1p4/Killy_V1_GUI.txt/file
242,Prison Life PRISON X V3.5,https://www.mediafire.com/file/bnrh54uy6lfibsv/Prison_Life_PRISON_X_V3.5.txt/file
243,Ragdoll Mania OP AUTO FARM [EASY LEADERBOARDS],https://www.mediafire.com/file/goslc1utkvfd83r/Ragdoll_Mania_OP_AUTO_FARM.txt/file
244,NEW ROBLOXSCRIPTS.COM FORUMS OUT NOW!,
245,VoxlBlade v000 ENEMY ESP,https://www.mediafire.com/file/ka1wviyesl9it6a/VoxlBlade_v000_ENEMY_ESP.txt/file
246,Build A Boat For Treasure AUTO FARM [UPDATE 2],https://www.mediafire.com/file/6yyvejvg1kxek37/Build_a_boat_AUTO_FARM.txt/file
247,VoxlBlade v000 TP BYPASS,https://www.mediafire.com/file/i9in9a2eykt3cu0/VoxlBlade_v000_TP_BYPASS.txt/file
248,ROBLOX UNIVERSAL INVISIBLE SCRIPT & LAG SWITCH,https://www.mediafire.com/file/c3evsblelcrqibj/ROBLOX_UNIVERSAL_INVISIBLE_%2526_LAG_SWITCH.txt/file
249,Phantom Forces BALLISTICS TRACKER FOR ALL GUNS,https://www.mediafire.com/file/yc6i2fa4t4eggxn/Phantom_Forces_BALLISTICS_TRACKER_FOR_ALL_GUNS.txt/file
250,Death Zone MOD NOTIFIER,https://www.mediafire.com/file/qjacaazkkignh6l/Death_Zone_MOD_NOTIFIER.txt/file
251,SharkBite AUTO TP GIFTS,https://www.mediafire.com/file/nt5sxjjypj3odji/Sharkbite_AUTO_TP_TO_GIFTS.txt/file
252,Arsenal KILL ALL ON E [V2] WORKS WITH KNIFE NOW!,https://www.mediafire.com/file/dwslgcqrtjigmhx/Arsenal_KILL_ALL_ON_E%252C_WORKS_WITH_KNIFE%2521.txt/file
253,RAGDOLL UNIVERSE GOD MODE,https://www.mediafire.com/file/n2x8fhoalr8lj6k/RAGDOLL_UNIVERSE_GOD_MODE.txt/file
254,Transfur Infection 2 GUI DECEMBER,https://www.mediafire.com/file/cjehiwqpsz6i85m/Transfur_Infection_2_GUI_Obfuscated.txt/file
255,Pastriez Bakery Cafe PASTRIEZ V1 GUI,https://www.mediafire.com/file/sk8j2f62txopr3l/Pastriez_Bakery_Cafe_PASTRIEZ_V1_GUI.txt/file
256,Venti Cafe INSTANT TRAINEE SCRIPT,https://www.mediafire.com/file/eua4gozpl4z0n6v/Venti_Cafe_INSTANT_TRAINEE_SCRIIPT.txt/file
257,Site 76 Prison Anomalies GUI V1 BYPASS DOORS & ITEM ESP,https://www.mediafire.com/file/kkk8tdxg1f5yo4p/Site_76_Prison_Anomalies_GUI_V1.txt/file
258,Phantom Forces REJOIN ON VOTE KICK,https://www.mediafire.com/file/jegxogkzmqvdfmi/Phantom_Forces_REJOIN_ON_VOTEKICK.txt/file
259,Skate Park PRESENT FARM,https://www.mediafire.com/file/sdqg7qlr4g82hgr/Skate_Park_PRESENT_FARM.txt/file
260,FPS HACKS V2.3,https://www.mediafire.com/file/o3j1l09liym6tpy/FPS_HACKS_V2.3.txt/file
261,The Streets GOD MODE [SOURCE],https://www.mediafire.com/file/efd8lnaq8im1279/The_Streets_GOD_MODE.txt/file
262,VoxlBlade v000 ENEMY ESP GUI,https://www.mediafire.com/file/eflb4lkngg3j4gf/VoxlBlade_v000_ENEMY_ESP_GUI.txt/file
263,Dragon Ball Rage AUTO FARM,https://www.mediafire.com/file/raudaa1uxn44wgp/Dragon_Ball_Rage_GUI_AUTO_FARM.txt/file
264,Front Runners GUI DECEMBER,https://www.mediafire.com/file/c918xol9qhyr9fv/Front_Runners_GUI_DECEMBER.txt/file
265,MacDonaldsville INFINITE MONEY,https://www.mediafire.com/file/xahalc3rdxaxzol/MacDonaldsVille_INFINITE_MONEY.txt/file
266,WEAREDEVS INFINITE JUMP REMADE AS A SYNAPSE SCRIPT,https://www.mediafire.com/file/xuwa3r8jsjvey7y/WRD_INFINITE_JUMP.txt/file
267,RoCitizens ITEM DUPER,https://www.mediafire.com/file/oe3kpeqenuq85r0/RoCitizens_ITEM_DUPER.txt/file
268,Miners Haven AUTO VOID MAZE SCRIPT,https://www.mediafire.com/file/u266tux2a5ocj19/Miners_Haven_AUTO_VOID_MAZE_SCRIPT.txt/file
269,Hunter x Online ANNOY PEOPLE SCRIPT,https://www.mediafire.com/file/j25mbc1extnu4ng/Hunter_x_Online_ANNOY_PEOPLE_SCRIPT.txt/file
270,"Attack on Titan: Freedom Awaits ODM MODIFIERS, ANTI GRAB & ANTI KICK + MORE!",https://www.mediafire.com/file/h9gkwoqc4ysisxl/Attack_on_Titan_Freedom_Awaits_ODM_MODIFIERS_ANTI_GRAB_%2526_ANTI_KICK_%252B_MORE%2521.txt/file
271,"AoT Downfall KILL AURA, INSTA KILL [OPEN SOURCE]",https://www.mediafire.com/file/l2g0abclxyram2f/AoT_Downfall_INF_BLADE_DURABILITY.txt/file
272,Jailbreak EJECT CRIMINALS [OPEN SOURCES],https://www.mediafire.com/file/9wvgn5mw621xlg3/Jailbreak_EJECT_CRIMINALS_%255BOPEN_SOURCE%255D.txt/file
273,WALLY HUB TRIAL [ENDS IN A FEW DAYS],
274,Jailbreak HASHES [CREATE YOUR OWN JAILBREAK CHEAT],https://www.mediafire.com/file/2qe66boe0cpk0az/Jailbreak_LATEST_HASHES.txt/file
275,Attack on Titan: Freedom Awaits AUTO FARM DECEMBER,https://www.mediafire.com/file/fe6rmsa6c7wltpg/Attack_On_Titan_Freedom_Await_AUTO_FARM.txt/file
276,Coin Hero Simulator AUTO FARM GUI,https://www.mediafire.com/file/en8fjt8pal0x9cw/Coin_Hero_Sim_AUTO_FARM_GUI.txt/file
277,Dream Topia Roleplay UNLIMITED MONEY,https://www.mediafire.com/file/q77h90z3dw348p2/Dream_Topia_Roleplay_UNLIMITED_MONEY.txt/file
278,World // Zero TRIAL SCRIPT,https://www.mediafire.com/file/zu7muqk5ej2l7l9/World_Zero_TRIAL_SCRIPT.txt/file
279,"King Piece BRING DF, AUTO FARM, TP ISLANDS",https://www.mediafire.com/file/s7y86rcnn1fvkzm/King_Piece_BRING_DF%252C_AUTO_FARM%252C_TP_ISLANDS.txt/file
280,Shindo Life NEW AUTO FARM GUI,https://www.mediafire.com/file/ucd88r70yyj4g1s/Shindo_Life_NEW_AUTO_FARM_GUI.txt/file
281,Sword Blox Online: Rebirth FULL SOURCE FROM APRIL,https://www.mediafire.com/file/03102mq1q3lgutg/SBOR-20201222T154641Z-002.zip/file
282,BEACHWAVE UNIVERSAL AIMBOT & VISUALS + PHANTOM FORCES GUI,https://www.mediafire.com/file/u1xm54sb9mn082s/BEACHWAVE.txt/file
283,Dragon Ball Z Final Stand AUTO FARM DECEMBER FREE,https://www.mediafire.com/file/ex151lunnr251um/DBZ_Final_Stand_NEW_AUTO_FARM_DECEMBER.txt/file
284,Lab Experiment NON SUS CHEATS,https://www.mediafire.com/file/h6xsj0ib9lbhjh0/Lab_Experiment_NON_SUS_CHEATS.txt/file
285,"D-DAY NO SPREAD, NO RECOIL, INSTANT RELOAD & TELEPORTS",https://www.mediafire.com/file/iwvcksn5h8lagc7/D-DAY_NO_SPREAD%252C_NO_RECOIL_%2526_MORE%2521.txt/file
286,A Universal Time KILL ALL PLAYERS [FE],https://www.mediafire.com/file/52zxkuzcwls2xqt/A_Universal_Time_KILL_ALL_PLAYERS_%255BFE%255D.txt/file
287,Dust: Wasteland Survival TELEPORT INTO BASES & ESP,https://www.mediafire.com/file/eq0c6zj83jkilt8/Dust_Wasteland_Survival_TELEPORT_INTO_BASES_%2526_ESP.txt/file
288,Blocks! TRAP ALL PLAYERS & DESTROY SERVER,https://www.mediafire.com/file/92kumybde2zwu1o/Blocks%2521_TRAP_ALL_PLAYERS_%2526_DESTROY_SERVER.txt/file
289,SKED’S VR SCRIPT [FIXED & WORKING AGAIN],https://www.mediafire.com/file/y756ysswi7meerd/SKEDS_VR_SCRIPT_FIXED.txt/file
290,rbxintel SNIPE YOUTUBERS & STREAMERS AS SOON AS THEY JOIN A GAME!,
291,FRIEND JOIN NOTIFIER SCRIPT,https://www.mediafire.com/file/1y00e9zgmkxpsgx/FRIEND_JOIN_NOTIFIER_SCRIPT.txt/file
292,Gods Of Glory UNLIMITED MANA DECEMBER 2020,https://www.mediafire.com/file/dnikv9vna9jrj7a/Gods_Of_Glory_UNLIMITED_MANA_DECEMBER_2020.txt/file
293,After The Flash: Mirage RANDOM CHARACTER ACCESSORIES CHANGE,https://www.mediafire.com/file/2u1b2avvzr0hlqp/After_The_Flash_Mirage_RANDOM_CHARACTER_ACCESSORIES_CHANGE.txt/file
294,Rumble Battle 2 KILL ALL,https://www.mediafire.com/file/gqrq1zsb9pqrsks/Rumble_Battle_2_KILL_ALL.txt/file
295,Reaper INSTA KILL,https://www.mediafire.com/file/iu249leywaqic0f/Reaper_%255BOPEN_TEST%255D_INSTA_KILL.txt/file
296,Online Business Sim 2 AUTO FARM DECEMBER 2020,https://www.mediafire.com/file/n0zrav33r4rjpa6/Online_Business_Sim_2_AUTO_FARM_DECEMBER_2020.txt/file
297,rblx-rip ASSET RIPPING TOOL [OPEN SOURCE],
298,Ultimate Driving: Westover Islands PRESENT AUTO FARM,https://www.mediafire.com/file/0tdhxhks2g50a2y/Ultimate_Driving_Westover_Islands_PRESENT_AUTO_FARM.txt/file
299,RoCitizens CHRISTMAS SCRIPT,https://www.mediafire.com/file/fo8h6mk46curolc/RoCitizens_CHRISTMAS_SCRIPT.txt/file
300,Grand Piece Online BYPASS & ISLAND ESP,https://www.mediafire.com/file/fzwrx04uwylxu7s/Grand_Piece_Online_ISLAND_ESP.txt/file
301,The Bonelands v2.0.6 KILL AURA [UPDATED],https://www.mediafire.com/file/2b3nuvbag08iupu/The_Bonelands_V2.0.6_KILL_AURA_%255BUPDATED%255D.txt/file
302,"A Universal Time KILL ALL SPAM [RUIN SERVER, OPEN SOURCE]",https://www.mediafire.com/file/9cnfxdcrej2zipq/A_Universal_Time_KILL_ALL_SPAM_%255BRUIN_SERVER%252C_OPEN_SOURCE%255D.txt/file
303,Miners Haven AUTO CHRISTMAS EVENT SCRIPT,https://www.mediafire.com/file/l2vnxad06tk6f3q/Miners_Haven_AUTO_CHRISTMAS_EVENT_SCRIPT.txt/file
304,ROBLOX HOW TO MAKE CHAT ART WITH EMOJIS,https://www.mediafire.com/file/4syiz5zzjkbwcc9/HOW_TO_USE_EMOJIS_IN_ROBLOX_CHAT.txt/file
305,Driving Empire EVENT AUTO FARM & ANTI AFK,https://www.mediafire.com/file/7z5b9p2701dz5y9/Driving_Empire_EVENT_AUTO_FARM.txt/file
306,Munition DAMAGE MULTIPLIER & GUN MODS,https://www.mediafire.com/file/zm4kgdhf53xbea9/Munition_DAMAGE_MULTIPLIER.txt/file
307,The Streets CUSTOM BULLET COLOURS,https://www.mediafire.com/file/kt8t9pz1fbmllsq/The_Streets_CUSTOM_BULLET_COLOURS.txt/file
308,The Legendary Swords RPG INFINITE REBIRTH,https://www.mediafire.com/file/bz3cpfbtvf4j85j/The_Legendary_Swords_RPG_INFINITE_REBIRTH.txt/file
309,Undertale 3D Boss Battle ULTRA GUI,https://www.mediafire.com/file/cp8ukzwxf2kopvl/Undertale_3D_Boss_Battle_ULTRA_GUI.txt/file
310,Bad Business NO RECOIL & SPREAD,https://www.mediafire.com/file/705a7p19qf3sqq7/Bad_Business_NO_RECOIL_%2526_SPREAD.txt/file
311,Hattori Hub SOURCE CODE,https://www.mediafire.com/file/zds194d015i4xut/Hattori_Hub_V4_SOURCE.txt/file
312,Phantom Forces CUMHAXX NEW,https://www.mediafire.com/file/unsfuar27si32pp/Phantom_Forces_CUMHAXX.txt/file
313,"Fall of Hell FREE SKILL POINTS, WINS & MONEY",https://www.mediafire.com/file/r428n6fy8k3y6jb/Fall_of_Hell_FREE_SKILL_POINTS_2.txt/file
314,ROBLOX UNIVERSAL AIMBOT / AIMLOCK DECEMBER 2020,https://www.mediafire.com/file/ujpyp7d9231p3dq/ROBLOX_UNIVERSAL_AIMBOT__AIMLOCK_DECEMBER_2020.txt/file
315,Fishing Simulator UNLIMITED FISH SCRIPT,https://www.mediafire.com/file/jq9hlex1qye3smj/Fishing_Simulator_UNLIMITED_FISH_SCRIPT.txt/file
316,Undertale Ultimate TimeLine SOULS AND DT SCRIPT,https://www.mediafire.com/file/0yw6v5jh0ioaaeo/Undertale_Ultimate_TimeLine_SOULS_AND_DT_SCRIPT.txt/file
317,Bakon ITEM / BAKON ESP SCRIPT,https://www.mediafire.com/file/koiidxuxrown1r5/Bakon_ITEM%252C_BAKON_ESP.txt/filehttps://www.mediafire.com/file/koiidxuxrown1r5/Bakon_ITEM%252C_BAKON_ESP.txt/file
318,Undertale 3D Boss Battles INSTA KILL GASTER,https://www.mediafire.com/file/50rx1qkpmu9ovjc/Undertale_3D_Boss_Battle_INSTA_KILL_GASTER.txt/file
