0,LGBTQ+ Hangout 2 CSGO Clan Tag Style Name,http://www.mediafire.com/file/doz8hbghwfcwenp/file
1,Koala Cafe AUTO FARM,http://www.mediafire.com/file/x1lpje2um3rxyb0/file
2,Border Roleplay NEW FREE GUI,http://www.mediafire.com/file/ujx1107kvd8hid2/file
3,A MODDED ADVENTURE NEW KILL ALL AND ITEM AUTO FARM,http://www.mediafire.com/file/fsgnu9z9hnemacj/file
4,Adopt Me V2 | Auto-farm | Obby Completion | Auto-Paycheque,http://www.mediafire.com/file/10rnx5dryrh3yhe/file
5,Phantom Forces PHANTOMWARE GUI STILL WORKS IN 2020,http://www.mediafire.com/file/vbnufzg3u0zq9z7/file
6,"Arsenal 101 HUB KILL ALL, AIMBOT & MORE!",http://www.mediafire.com/file/yijc06eluwt0l1a/file
7,"Arsenal GUI, TELEPORT ALL, AIMBOT & MORE!",http://www.mediafire.com/file/z9jf8ksnlf63ety/file
8,Bloxburg HAIRDRESSER SPOODERBURG GUI AUTO FARM,http://www.mediafire.com/file/fazcfnppnfix7cj/file
9,"Tower of Hell OP GUI, GOD MODE & MORE!",http://www.mediafire.com/file/4kqa7va3c3ceyhr/file
10,Bubble Gum Simulator BUBBLE BREAKER V2 GUI,http://www.mediafire.com/file/q8xqrf90lkte9wa/file
11,Mining Champions AUTO MINE CLOSEST THING TO YOU SCRIPT,http://www.mediafire.com/file/j7oe4iowh5x24px/file
12,Mining Champions FARM GEMS SCRIPT,http://www.mediafire.com/file/9n86epywj343y1b/file
13,Free Draw 2 GIVE YOUR SELF 50 LAYERS SCRIPT,http://www.mediafire.com/file/qtk5mp66e9k1z76/file
14,Da Hood AUTO FARM HOSPITAL JOB,http://www.mediafire.com/file/6gxfyfgafzts0wl/file
15,Da Hood ANTI FLASHBANG SCRIPT,http://www.mediafire.com/file/j8bv93gfxcs0obf/file
16,Da Hood AUTO FARM 0% BAN RISK [OPEN SOURCE],http://www.mediafire.com/file/hnamtln9ne2kojv/file
17,Bloxburg FREE GAMEPASSES  & MAX SKILLS SCRIPT,http://www.mediafire.com/file/swlcm9d2wo2pxo0/file
18,World of Magic TELEPORT AND ESP EXILE / MINOTAUR GUI,http://www.mediafire.com/file/hyf46b517n8aq70/file
19,Da Hood P90 AUTO FARM (UNPATCHED) BEST AUTO FARM,http://www.mediafire.com/file/v4al5tzv8dbxvqo/file
20,tabledumper,https://github.com/op0x59/tabledumper
21,Exoria World’s End PICKUP ALL TRINKETS,http://www.mediafire.com/file/apla7ocq03o7vxj/file
22,Exoria World’s End TRINKET ESP,http://www.mediafire.com/file/i84pm8v5q7l29e5/file
23,One Piece Prime AUTO FARM GUI,http://www.mediafire.com/file/2x49lnqesq81y3i/file
24,Murder Mystery 2 OP GUI COIN AUTO FARM & MORE!,http://www.mediafire.com/file/mmkj55x4ds0jfuv/file
25,"CRITICAL STRIKE v5.5.2 GOD MODE , KILL ALL & MORE!",http://www.mediafire.com/file/nl694tbz3u3uc25/file
26,HxH Worlds CHEST AUTO FARM & AUTO DUMBBELL,http://www.mediafire.com/file/8tavt8t1amre01z/file
27,Horrific Housing GET ALL FURNITURE / ORNAMENTS,http://www.mediafire.com/file/5jynmy2a0a9ua6l/file
28,Spider AUTO WIN SCRIPT,http://www.mediafire.com/file/m1ctmw8ts3bkw3i/file
29,Your Bizarre Adventure UPDATED ITEM ESP,http://www.mediafire.com/file/uk55ujn44os5qi8/file
30,"A Universal Time ITEM TP, ANTI TS, SELL ITEM, ETC [UPDATE 4] [OPEN SOURCE]",http://www.mediafire.com/file/zg7b60g9l0xc4tq/file
31,Linkvertise Bypasser [SIR MEME VOUCHED],https://mega.nz/file/NFtXBBiQ#uBA0f-vvAmHowIN7bKq0rb6TxXEkDG7Az--OyKYwQT4
32,A MODDED ADVENTURE STAND FARM,http://www.mediafire.com/file/k7m62lp1g1idkuq/file
33,"Therapy Center SSC GUI V1, DISABLE ANTI EXPLOIT & MORE!",http://www.mediafire.com/file/iy6s55r5oz5w4dx/file
34,"Notoriety KILL ALL, GOD MODE, INFINITE STAMINA & MORE!",http://www.mediafire.com/file/7f5hvzzpa8e4e95/file
35,Ragdoll Royale UPDATED OP SCRIPT,http://www.mediafire.com/file/ee4txnsx3ycmjul/file
36,"One Punch Man: Destiny ANTI MOD, AUTO FARM & AUTO TRAIN!",http://www.mediafire.com/file/3d2f625kljjb942/file
37,Dark Dex V4 (Hidden HIDDEN properties; Updated Icons; More),http://www.mediafire.com/file/kk1qvl6rr2hmnla/file
38,Demon Slayer RPG 2 ALL YOU NEED GUI,http://www.mediafire.com/file/0eolfcxmijpsytd/file
39,Mortem Metallum A FEW OP UPDATED SCRIPTS,https://robloxscripts.com/
40,ANTI CHAT LOG (NEVER GET BANNED FOR SWEARING),http://www.mediafire.com/file/vfsjv2pwkogwob5/file
41,Phantom Forces UNDETECTABLE ESP,http://www.mediafire.com/file/qwe5fljovysgf1g/file
42,"Venti Cafe ANTI EXPLOIT BYPASS, REMOVE BORDERS",http://www.mediafire.com/file/fgey9nn1pkhl2vq/file
43,"Akimbo Hub FREE, 10+ GAMES! [UI OVERHAUL]",https://discord.gg/ttBXYKQ
44,One Punch Man: Destiny AUTO FARM & AUTO QUEST + MORE!,http://www.mediafire.com/file/4j2lb6pg61nvwua/file
45,Stay alive and flex your time on others AUTO KILL BOT [UPDATE],http://www.mediafire.com/file/fw9jgaghbk5gn78/file
46,AUTO REPLY | FE | Replies to people in chat,http://www.mediafire.com/file/f8746785sge4u5g/file
47,Oofing Legends AUTO FARM GUI [UPDATED],http://www.mediafire.com/file/mdlms4omjgx6zsk/file
48,Cook Burgers NEW GUI [UNPATCHED],http://www.mediafire.com/file/ul98yn3y57bqbk0/file
49,Dynamic Ship Simulator III AUTO FARM,https://robloxscripts.com/
50,Celestial Silent Aim (UNIVERSAL),http://www.mediafire.com/file/bh2u3d9tzy6n9xi/file
51,Lumber Tycoon 2 AUTO DUPE MONEY 2020,http://www.mediafire.com/file/92zu32g6h9w45nh/file
52,Quick Loader LOAD ROBLOX FASTER SCRIPT [REVAMP],http://www.mediafire.com/file/7nfazcdb3suu24b/file
53,"Ragdoll Engine GUI, CRASH SERVER, BOMB SERVER & MORE [WORKING]",http://www.mediafire.com/file/p0o0o9wmturtyt3/file
54,NEVER GET BANNED!Discord-Based Roblox Alt Generator [21K+ ACCOUNTS],https://discord.gg/mhdfW38
55,Loomian Legacy GUI [OVERPOWERED] [AUTOBUY] [AUTOWHITELIST] [PAID $10],https://discord.gg/cVCPWRN
56,Arsenal FREE COW SKIN AND BADGE SCRIPT,http://www.mediafire.com/file/6wvy0ujmqa4hqif/file
57,Phantom Forces johnsenZe GUI [PFPWNER CRACK LMAO WHAT?] [FREE],http://www.mediafire.com/file/vpi7figoelvqin4/file
58,Shark Evolution AUTO FARM GUI [UPDATED],http://www.mediafire.com/file/h6qgv737t0594w5/file
59,Badge Walk FREE 10.2K BADGES SCRIPT [USE BEFORE PATCH],http://www.mediafire.com/file/wtg9xraq1m2z973/file
60,Tapping Masters AUTO FARM GUI SEPTEMBER 2020,http://www.mediafire.com/file/9yv8q4dfkghv8e0/file
61,Mortem Metallum AUTO PARRY FREE SCRIPT,http://www.mediafire.com/file/p51bvyp5fh2gnev/file
62,Sharp Hub Source Code [400+ BUYERS],http://www.mediafire.com/file/ewgxqeez0625fwq/file
63,RoCitizens NEW MONEY SCRIPT,http://www.mediafire.com/file/ox0drekqcfbbypg/file
64,"Bomb Simulator AUTO UPDATE, MULTI AREA FARMING & MORE!",http://www.mediafire.com/file/cj4h3j4o0ry9cf9/file
65,Combo Clickers NEW AUTO FARM GUI SEPTEMBER 2020,http://www.mediafire.com/file/i8zsup1cm33w2s8/file
66,"Shinobi Storm V6 GUI, GOD MODE & UNOBTAINABLE MOVE SETS",http://www.mediafire.com/file/zwx942b6ud5kg8l/file
67,Super Power Fighting Simulator AUTO FARM GUI SEPTEMBER 2020,http://www.mediafire.com/file/n630bnze32r9hfg/file
68,Islands BERRY FARM SCRIPT,http://www.mediafire.com/file/gll1jot9keqsjn9/file
69,FE Scripts people are trying to sell,http://www.mediafire.com/file/182afbmnxjqmpsg/file
70,Teddie Simulator AUTO FARM GUI,http://www.mediafire.com/file/9xkv4chxq8h0gcf/file
71,Roblox’s Got Talent AUTO FARM,http://www.mediafire.com/file/xkl3iphlhgugeo2/file
72,Anti-AFK GUI ROBLOX,http://www.mediafire.com/file/lh8jbtfkhw47bxk/file
73,Attack On Titan: Last Breath KILL AURA SCRIPT,http://www.mediafire.com/file/8tty3enckpqebbc/file
74,"Wizard Hub FREE SCRIPT HUB, 40+ SCRIPTS!",http://www.mediafire.com/file/1dnhrh489o6f61o/file
75,"Legend RPG II GUI, DISABLE NPCS, AUTO FARM & MORE!",http://www.mediafire.com/file/rruwcsm63m69ac4/file
76,A Universal Time TELEPORT ITEMS SCRIPT,http://www.mediafire.com/file/kb0jpwuub24ybby/file
77,"Project Pokémon Clones,  Aura, Shiny & Form Spawner",http://www.mediafire.com/file/a3hbozzkx2pe6qc/file
78,War Simulator SCRIPT [STILL WORKING],http://www.mediafire.com/file/ldqqju0o8h35gj5/file
79,"Avatar: The Last Airbender OP AUTO FARM, MAX LEVEL WITHIN MINUTES",http://www.mediafire.com/file/j03qlhwy854prip/file
80,Arsenal MONEY SCRIPT [3600 MONEY),http://www.mediafire.com/file/mytt4a499pjnkus/file
81,A Bizarre Day ITEM FARM,http://www.mediafire.com/file/jeb2k9hp4xektn8/file
82,MESSAGE SPAMMER ON ROBLOX [OP FOR TROLLING],http://www.mediafire.com/file/yj2ilhwzbzehi6l/file
83,Dungeon Quest PAID AUTO FARM GUI [BEEN AROUND FOR 1 YEAR] [1.5K BUYERS!] [$3],
84,Ez Hub V2 2.3 UPDATE [ALL NEW EXCLUSIVES],http://www.mediafire.com/file/nlszlwyn2glty2p/file
85,Vehicle Simulator AUTO FARM,http://www.mediafire.com/file/phnv10860anqviu/file
86,Arsenal AUTO FARM / KILL AS SPECTATOR,http://www.mediafire.com/file/bn71v2ehg7gakop/file
87,A Bizarre Day GUI V1.6 CREATIVEHELL,http://www.mediafire.com/file/bdxwv4hc0fy9ulk/file
88,Project JoJo NOVA V7 GUI [V8 COMING SOON],http://www.mediafire.com/file/7r14tu4r5r378h5/file
89,"Islands GUI , TONS OF OP AUTO FARM FEATURES, JXNT #1 GUI FREE",http://www.mediafire.com/file/tp3o1nbfph9oqxs/file
90,ROBLOX CHAT BYPASSER [UPDATED],https://mega.nz/file/GbQBmSoA#grBKPRSb3U223VA7pFLxAFO7g4azon4ri0NxI7hiFKs
91,UNANCHORED TO PLAYER GUI [FE] DESTROY ALL GAMES [SYN X ONLY],http://www.mediafire.com/file/9whbmedt5mnguu5/file
92,NEVER GET BANNED FROM EXPLOITING [UPDATED – V2],http://www.mediafire.com/file/8926bicz73wuodr/file
93,"FE HAIR FLING SCRIPT , PUT YOUR MOUSE OVER A PLAYER TO FLING",http://www.mediafire.com/file/svylw7zf89uyq2e/file
94,UNIVERSAL HITBOX EXPANDER [UPDATED UI],http://www.mediafire.com/file/kzz4lh8mlr1ttbl/file
95,Stand Upright AUTO RE ROLL [SYN X & PROTO ONLY],http://www.mediafire.com/file/10f91c6jgvx1759/file
96,"RoVille GUI AUTO WORK, LAG SERVER & MORE!",http://www.mediafire.com/file/vswmv64djax555q/file
97,Anime Fighting Simulator STELLAR’S OPEN SOURCE AUTO FARM GUI,http://www.mediafire.com/file/l20a7rv95gkied3/file
98,Roblox FPS BOOSTER SCRIPT [UPDATED],http://www.mediafire.com/file/2anra1w2mmlppw2/file
99,Jailbreak THE BEST FREE AUTO ROB [UPDATED V1.2.9 POWER PLANT],http://www.mediafire.com/file/fhodj4c3wpma3bd/file
100,"ROBLOX GROUP FINDER V3, EARN TONS OF ROBUX, LINUX + MAC & WINDOWS SUPPORT",https://anonfiles.com/v7d7z4E1o3/GroupFinder.deps_zip
101,"Ro-Ghoul AUTO FARM [UPDATED, NISHIKI BOSS ADDED]",http://www.mediafire.com/file/t1gouc4y0voz85x/file
102,ROBLOX IN LINE CHAT TRANSLATOR SCRIPT [TRANSLATE ROBLOX CHAT],http://www.mediafire.com/file/75bzv8y78m8w1h3/file
103,ROBLOX EMPTY SERVER GENERATOR,https://cdn.discordapp.com/attachments/718811760752197713/723932737324449852/VIP_Generator.rar
104,Driving Simulator V1.04 AUTO FARM GUI,http://www.mediafire.com/file/3ku80v7x279i5z2/file
105,RoBeats AUTO PLAYER SCRIPT [UNPATCHED],http://www.mediafire.com/file/hiz1lx5ou0dq2v0/file
106,ROBLOX SERVER PINGER [WORKS IN EVERY GAME],http://www.mediafire.com/file/l16ormodlr9lzcr/file
107,Mad City MONEY FARM [30 MIN = 1 MILL CASH],http://www.mediafire.com/file/jkaay2v6s2zsu1r/file
108,AimHot v8 (OPEN SOURCE UNIVERSAL AIMBOT),https://github.com/Herrtt/AimHot-v8/archive/master.zip
109,ROBLOX ANTI ROBUX STEALER SCRIPT,http://www.mediafire.com/file/gj1tg42j3tsgni7/file
110,"My Restaurant GUI INSTANT APPLIANCES, BLACKLIST ALL & MORE!",http://www.mediafire.com/file/vww8959fjbt0swq/file
111,"Dawn of Aurora BACK STAGE RELEASE, MULTI HACK & MORE!",http://www.mediafire.com/file/463vsx1yc3e872l/file
112,ROBLOX FE ANIMATIONS GUI,http://www.mediafire.com/file/cb6q7y3kmbd19gt/file
113,Vehicle Simulator AUTO FARM [UNPATCHED],http://www.mediafire.com/file/q1ud2rsaj68a9m5/file
114,Online Business Simulator 2 INFINITE XP & MONEY SCRIPT,http://www.mediafire.com/file/x6g8f0ccjdwsz5r/file
115,Jailbreak ANTI CAGE SCRIPT 2020,http://www.mediafire.com/file/f3rp6ralsmchy7j/file
116,"Phantom Forces FREE GUI, AIMBOT, TRACERS, GUN MODS & MORE! [UPDATED]",http://www.mediafire.com/file/mg1jbrawh9xhp9i/file
117,"Anomic UNLIMITED AMMO, STAMINA & SILENT AIM",http://www.mediafire.com/file/gfq26jd4o8w1fl3/file
118,"Square Piece AUTO FARM [UPDATED] DF SKILLS, BUSO & MORE!",http://www.mediafire.com/file/xf6gddntqr7mrfu/file
119,"RECOIL ZOMBIES GUI V2, GIVE ALL WEAPONS & MORE!",http://www.mediafire.com/file/jgacpq39n5fnfoi/file
120,Sakura Stand OP COMMANDS,http://www.mediafire.com/file/g33uo4x2kz74wjn/file
121,Murder Mystery 2 LUCIDITY GUI,http://www.mediafire.com/file/8ngs1387q0h2wz2/file
122,Dungeon Quest GUI [FORCE TRADE],http://www.mediafire.com/file/mduqpzhi0l379su/file
123,Rogue Lineage COLLECTOR AUTO FARM SOURCE CODE,http://www.mediafire.com/file/7scbyuf5zujr31e/file
124,Dragon Blox Ultimate MEGUMU’S AUTO FARM GUI,http://www.mediafire.com/file/4eze5tahhazcjih/file
125,"Work at a Pizza Place FE MUSIC, AUTO ORDERS",http://www.mediafire.com/file/8f9mzzx6ddx3t58/file
126,"FluxHub BLOXBURG, ARSENAL & LIFTING SIM [PREMIUM FREE SCRIPTS]",http://www.mediafire.com/file/e1n5prbx4ormup5/file
127,UNIVERSAL SILENT AIM [MASSIVE UPDATE],http://www.mediafire.com/file/opw3vyobfvoe4hg/file
128,"ROBLOX SPOTIFY GUI (USE SPOTIFY IN GAME, SPOTIFY API) (SYNAPSE X ONLY)",http://www.mediafire.com/file/mp8kh4diedcw3lc/file
129,"Roblox Get any rank in a group! (HR, ADMIN, OWNER)",https://robloxscripts.com/
130,Tower Defense Simulator AUTO FARM GUI,http://www.mediafire.com/file/rm8xb6c4264omzf/file
131,"RECOIL | BETA ESP, AIMBOT & AUTO AMMO REFILL",http://www.mediafire.com/file/0i4t9cubzy6kd8y/file
132,Tower Heroes THE #1 AUTO FARM [200 COINS P/H] [170 XP P/H],http://www.mediafire.com/file/sqmwn77bvgjvsy5/file
133,"The Wild West GUI, ANIMAL AND PLAYER HITBOXES + MORE!",http://www.mediafire.com/file/xif6k3juyc5acne/file
134,Breaking Point ARCADE MACHINE WIN EVERYTIME COIN AUTO FARM,http://www.mediafire.com/file/vg6vjtzm2gajd9p/file
135,"The Streets VIBING, 50+ COMMANDS, INSTA TELEPORT & MORE!",http://www.mediafire.com/file/v2num6q3dk2ovax/file
136,Creatures of Sonaria GOOD AUTO FARM,http://www.mediafire.com/file/ofoihi49lktncos/file
137,Heroes Academia AUTO FARM 2020,http://www.mediafire.com/file/oekzc38d1sb1nzj/file
138,SoulShatters Test Place ENABLE BASEPLATES AND FLOORS SCRIPT,http://www.mediafire.com/file/6nalgxkjt9ej4z5/file
139,"ROBLOX FRIEND FINDER, FINALLY GET FRIENDS ON ROBLOX 2020",https://cdn.discordapp.com/attachments/754489753168248942/754489767885799534/FriendFinder.zip
140,Heroes Academia AUTO FARM [OP] [ADDED PRESTIGE],http://www.mediafire.com/file/h53creck87ht6xj/file
141,Phantom Forces KRNL & SYNAPSE X ONLY GUI [REALLY OP] [NEW],http://www.mediafire.com/file/njjbggp7e3r87px/file
142,Formula ROBLOX SUPER CAR SCRIPT,http://www.mediafire.com/file/je3khg9qtdg7pw5/file
143,"Dream Topia Roleplay GUI, HAT & BLOCK SPAM, INFINITE MONEY",http://www.mediafire.com/file/sqv53u5wog1no68/file
144,Cheat Engine [Synapse UI] [HOT],https://cdn.discordapp.com/attachments/692034876014198824/744243168920338502/Cheat_Engine.rar
145,Spaceship Tycoon INFINITE MONEY,http://www.mediafire.com/file/smynnp2ww3d7aj3/file
146,Tower of Hell INVINCIBILITY / GOD MODE SCRIPT,http://www.mediafire.com/file/egi16dluzd2rsqj/file
147,Jailbreak VYNIXIUS JAILBREAK GUI [OP],https://discord.me/vynixuhangout
148,Unit: Classified KILL ALL [SOURCE],http://www.mediafire.com/file/67zrsmbcdnvh7ul/file
149,"Ro-Punch Man AUTO FARM, AUTO QUEST GUI",http://www.mediafire.com/file/ys7u0vdejtilgpv/file
150,Sound Space LEGIT AIMBOT,http://www.mediafire.com/file/bgr46wgw7ap5nhg/file
151,Phantom Forces BULLET DIRECTION SPOOFER (CAN MAKE A SILENT AIMBOT) [SOURCE],http://www.mediafire.com/file/4xkjnob0wlkg1ql/file
152,"CRITICAL STRIKE v5.6.1 KILL ALL, NO COOLDOWNS, APPLY BUFFS, GOD MODE, HEAL",http://www.mediafire.com/file/n9e0w02et0rol6i/file
153,Anarchy: Old School V2 HITBOX BUFF,http://www.mediafire.com/file/19odpc8xjc92ynz/file
154,"ROBLOX FOLLOWER BOT, NO COOKIES OR PROXIES REQUIRED, HUNDREDS PER CLICK,",
155,[FE] SPAWN IN A NAMELESS R6 CHARACTER WITH COMMANDS,http://www.mediafire.com/file/9j43cljxvqxb7fh/file
156,ROBLOX CHAT LAG SCRIPT [LAG OUT CHAT],http://www.mediafire.com/file/5689xsztdo7q143/file
157,"Unit: Classified NEW GUI SILENT AIM, KILL ALL, ESP & MORE!",http://www.mediafire.com/file/797oefs2mqj1kut/file
158,A Universal Time A UNIVERSAL FARMER AUTO FARM GUI,http://www.mediafire.com/file/eojblqd0816nbyn/file
159,"Fitness Simulator AUTO LIFT, AUTO SELL & KILL AURA BOSS GUI",http://www.mediafire.com/file/xv7lvaqnpapcoxo/file
160,Boys and Girls Night Out INFINITE CASH,http://www.mediafire.com/file/rwplctz2wh1bgxd/file
161,Vibe NYC ALL ITEMS,http://www.mediafire.com/file/5ncsi3e1tqcyr7g/file
162,UnderTale: Merged Multivers OP SOUL POINTS FARM,http://www.mediafire.com/file/beu023ouql7ydi1/file
163,Wayfort Beta AUTO FARM,http://www.mediafire.com/file/eud0cfmslqkgkec/file
164,"Dream Topia Roleplay INFINITE MONEY, INVISIBLE NAME GUI",http://www.mediafire.com/file/iz52p4melc3qbo7/file
165,Stefan’s RemoteSpy v4.2 [SYNAPSE X ONLY],http://www.mediafire.com/file/ceet6g19korj2y1/file
166,"Dealership Simulator GUI V1 INFINITE INCOME, ADD INCOME, ADDED LOOPS",http://www.mediafire.com/file/04qqi25tw54xomw/file
167,Pet Battle Simulator NEW AUTO FARM GUI 2020,http://www.mediafire.com/file/g6j1qw6zx0ty281/file
168,Flag Wars OP GUI FAST MONEY,http://www.mediafire.com/file/kyo33j07h49k01y/file
169,ROBLOX FE BAN HAMMER,http://www.mediafire.com/file/u3femcm1flkqa81/file
170,"Roblox Minerscraft KILL AURA, SUPER OP GUI V1",http://www.mediafire.com/file/mmadkffdbgfyh32/file
171,Creatures Of Atherian BINARY CHAT SPAMMER [TROLLING],http://www.mediafire.com/file/orj0r6x50fs6h02/file
172,Mining Champions AUTO FARM GUI FREE,http://www.mediafire.com/file/dciyles6uupwzwc/file
173,PROJECT SUBMUS ACCUDO DEMO INSTANT KILL / DAMAGE MULTIPLIER,http://www.mediafire.com/file/44o0iexy5bw83on/file
174,Tapping Eggs FREE ROBUX PETS,http://www.mediafire.com/file/y2d565wycjr0wrd/file
175,Dance Moms GUI V1 FLING AND KILL,http://www.mediafire.com/file/8zb6mfe7o256u69/file
176,"One Piece Prime AUTO FARM, AUTO COLLECT CHESTS / DEVILFRUIT",http://www.mediafire.com/file/dtr3p71o4x7fo7u/file
177,Reverse Chat ALL YOUR TEXT IN ROBLOX CHAT IS AUTO BACKWARDS [TROLLING],http://www.mediafire.com/file/s5kmqx3daurwvv2/file
178,Project Zeg INSTANT BEAT BOSS,http://www.mediafire.com/file/x9gfjzcenruhqub/file
179,Parkour POINT AUTO FARM,http://www.mediafire.com/file/oaiggj5tyxqn5w7/file
180,"ENLITE Theatre V6.2, SERVER LAGGER , UNPATCHED AND OP",http://www.mediafire.com/file/1rz65vjnw36jw3p/file
181,Prison Life NEW UPDATED JMUSE GUI V3.1,http://www.mediafire.com/file/u3n6ciq0avkxb9i/file
182,"One Punch Man: Destiny AUTO FARM, AUTO QUEST & MORE GUI",http://www.mediafire.com/file/ml00rufikq8xl4v/file
183,Undersiders : Legacy MINE AURA AND ONE SHOT ALL ORES,http://www.mediafire.com/file/13hy48bvwh3lj3t/file
184,"Dragon Blox Ultimate BILLS MULTI FARM, REBIRTH GRINDER & EARTH MULTI FARM",
185,Swordburst 2 DAMAGE MULTIPLIER [UPDATED],http://www.mediafire.com/file/qptzv48vlvxp8it/file
186,Cook Burgers GUI [UNPATCHED],http://www.mediafire.com/file/1ytldp8258t2f11/file
187,"1ST + 3RD PERSON AIMBOT [ARSENAL, COUNTER BLOX & MORE]",http://www.mediafire.com/file/x82kce3bgkibg84/file
188,Arsenal DEATH TO ARSENAL GUI NEW SEPTEMBER 2020,http://www.mediafire.com/file/wzvfpbzqnip3s2a/file
189,Tatakai AUTO ROADWORK SCRIPT,http://www.mediafire.com/file/okcysui41kmejqj/file
190,A Universal Time SPAM KILL ALL,http://www.mediafire.com/file/ek8l1z6fpz661s3/file
191,FREE ROBLOX VIP SERVERS [SEPTEMBER 2020],http://www.mediafire.com/file/xzslvf4oe4vf8ri/file
192,CRACKED SERVER SIDES PACK [100+],
193,CRIMINAL VS. SWAT KILL PLAYER GUI,http://www.mediafire.com/file/87dy64p4vfy82so/file
194,Identity Fraud ESP & CHAMS,http://www.mediafire.com/file/e5q61uq98h2wx5a/file
195,A Universal Time NEW AUTO FARM,http://www.mediafire.com/file/eznx9old9p3bq9r/file
196,generic roleplay gaem. AUTO FISH SCRIPT,http://www.mediafire.com/file/igx0p6w73ad5omg/file
197,Tatakai MONEY AUTO FARM SEP 2020,http://www.mediafire.com/file/t8cd8gtwlqk4isy/file
198,Project Legends SPAWNER [BYPASSES NEW ANTI EXPLOIT],http://www.mediafire.com/file/whfaysun6z2rxz6/file
199,Dragon Adventures FREE PAID SCRIPTS [PACK],http://www.mediafire.com/file/jcxl9e85slclrkd/file
200,Elemental Battlegrounds AUTO SKILL AIMBOT,http://www.mediafire.com/file/dsg3vpuifsr24rd/file
201,MyPark BALL SIZE SCRIPT [HUGE BALL SCRIPT],http://www.mediafire.com/file/qji78ty19uwb31k/file
202,A Universal Time CRASH SERVER [REAPER ONLY],http://www.mediafire.com/file/pqqvhcwxdtjzvc8/file
203,Clicker Story GUI SEPTEMBER 2020,http://www.mediafire.com/file/845uk07levctpjj/file
204,3-2-1 Blast Off Simulator GUI [UPDATED] [V1.2a],http://www.mediafire.com/file/c3uvwuaql5xtmb9/file
205,Splash: Music and Dance AUTO FARM,http://www.mediafire.com/file/75izyg61ilzg1zf/file
206,DUCK HUB FREE SCRIPT HUB [ARSENAL / JAILBREAK],http://www.mediafire.com/file/nyoz5m18wkza4fs/file
207,Mining Champions NEW SCRIPT [OP],http://www.mediafire.com/file/aivf7nrjgye4w6j/file
208,Garden Simulator EQUIP ANY PET SCRIPT,http://www.mediafire.com/file/m2v42rxjdhvxa9y/file
209,Tatakai AUTO TRAIN SCRIPT,http://www.mediafire.com/file/lfovftdu4m9s8wj/file
210,LUCKY BLOCKS Battlegrounds BEST SCRIPT 2020,http://www.mediafire.com/file/eogeog2gvaby5ti/file
211,SHOOT OUT SILENT AIM + BONUS GUN MOD SCRIPT,http://www.mediafire.com/file/4kmq82skxgz1xdo/file
212,NEON HUB – SIMULATOR GAME SCRIPT HUB FREE,http://www.mediafire.com/file/cp4og7vn4xjw6fz/file
213,"Mining Champions GUI , AUTO ORES , AUTO GEMS & MORE !",http://www.mediafire.com/file/pq374s70maxkgde/file
214,Military Combat Tycoon INFINITE MONEY SCRIPT,http://www.mediafire.com/file/5vlaowg6wapo9xy/file
215,AltBot [Roblox Alt Generator] [SOURCE CODE],https://github.com/Arilis/AltBot
216,sangWARE – FE SCRIPT HUB FREE,
217,Site-76: Prison Anomalies ITEM ESP SCRIPT,http://www.mediafire.com/file/vefu2vxjiebv6k8/file
218,A Universal Time MEGUMU’S ITEM TP & AUTO SELL SCRIPT,http://www.mediafire.com/file/vf7yem6x3fqqz1p/file
219,B: Rebirth AUTO FARM GUI,http://www.mediafire.com/file/0t9o32qmqmgyu3d/file
220,Football Fusion NEW PatriotsHax GUI [SEP 2020],http://www.mediafire.com/file/1fa9kyj89zltcqk/file
221,Universal Studios Roblox Theme Park HALLOWEEN HORROR NIGHTS LINE SKIPPER SCRIPT,
222,"World // Zero NEW FREE GUI, SEPTEMBER 2020",http://www.mediafire.com/file/6hv6701ngnuwrpt/file
223,Formula ROBLOX WIN RACE SCRIPT,http://www.mediafire.com/file/ywh65leep8g7gg1/file
224,ROBLOX BASIC FPS BOOSTER [ANTI LAG] 3 VERSIONS OF THE SCRIPT,http://www.mediafire.com/file/ynpifib64hfsdwe/file
225,A FEW BYPASSED ROBLOX AUDIOS,http://www.mediafire.com/file/4go318jrtd92yiy/file
226,Radium HUB CRACKED,http://www.mediafire.com/file/2ecg66pa8w3f7qo/file
227,Ragdoll Royale NEW GUI [OP],http://www.mediafire.com/file/fu5medk1o807skk/file
228,One Punch Man: Destiny AUTO CLASS SPIN SCRIPT,http://www.mediafire.com/file/k0f7th3j6ozohd8/file
229,Jailbreak CRASH GAME SCRIPT,http://www.mediafire.com/file/41iz2s78i4eh7fe/file
230,ROBLOX KILL ALL HUB,http://www.mediafire.com/file/v5b5fy5exqvoqsg/file
231,"Freeze Tag ALWAYS WIN, AUTO PLAY, ANTI AFK, INSTANT WIN",http://www.mediafire.com/file/4si77dn53uybzvj/file
232,"Infinite Autocorrect TYPING MULTIPLIER , TOOL MULTIPLIER & MANY BADGES",http://www.mediafire.com/file/iluzfvswhu9b4b1/file
233,Space Combat Tycoon INFINITE MONEY SCRIPT,http://www.mediafire.com/file/9scalm8hntlpq4h/file
234,ROBLOX FE POINT AT STUFF SCRIPT [R6 ONLY],http://www.mediafire.com/file/wggop5ace1u6b9r/file
235,"Impostor ADVANCED PLAYERLIST, COMPLETE ALL TASKS + MORE!",http://www.mediafire.com/file/ei3542li5j7mki9/file
236,"King Piece AUTO FARM , TP DF & MORE!",http://www.mediafire.com/file/15qkl5h2of9rhlx/file
237,3-2-1 Blast Off Simulator AUTO FARM,http://www.mediafire.com/file/ug1zkd9r81fdfiv/file
238,Gas Station Simulator AUTO WORK AT PUMP,http://www.mediafire.com/file/644wmrz8fp6emfb/file
239,"ALOHA SOURCE CODE [UPDATED] [FIXED] BEST ISLANDS GUI, OP SCHEMATICA",
240,Lua Discord Nitro Generator [works in repl],http://www.mediafire.com/file/p1mugvwb4ba7hka/file
241,Impostor NEW GUI SEPTEMBER 2020,http://www.mediafire.com/file/8v8lhx221ge1a7u/file
242,Mini Golf INSTANT HOLES & INFINITE CREDITS SCRIPT,http://www.mediafire.com/file/kzyfia8lcrcml8k/file
243,Area 52 TEAM CHANGE GUI [ADMIN X RELEASE],http://www.mediafire.com/file/4v4o4yfox8q02pq/file
244,"Stand Universe NEW GUI, KILL AURA, ITEM TP, GOD MODE",http://www.mediafire.com/file/k9lcmf4sj5sgm9e/file
245,A Universal Time MEGUMU’S KILL ALL SCRIPT,http://www.mediafire.com/file/za1hp6mpbm6untq/file
246,ROBLOX SHIRT/PANTS TEMPLATE GRABBER [MASS TEMPLATE GRABBER] [UPDATED],http://www.mediafire.com/file/osqdt28ec7883wa/file
247,Hoops – Demo HITBOX EXPANDER FOR MORE STEALS,http://www.mediafire.com/file/agubemq5wnxmy8x/file
248,"Pistol 1v1 GUN MODS, SPAWN GUNS & KNIFE SPEED SCRIPT",http://www.mediafire.com/file/o8yis2pyoq9q65k/file
249,"4 Player Fortnite Tycoon AUTO COLLECT CASH, AUTO UPGRADE",http://www.mediafire.com/file/pg21n9hi1tp7lpy/file
250,World Zero TOWER SCRIPT V2,http://www.mediafire.com/file/isfx1khyv2ooc40/file
251,"Star Wars Tycoon AUTO COLLECT CASH, CLEAN GAME",http://www.mediafire.com/file/ps0t78xl6u192o5/file
252,"Super Hero VS Anime Tycoon AUTO COLLECT CASH, CLEAN GAME",http://www.mediafire.com/file/9lz5sew940rafzf/file
253,"2 Player Ninja Tycoon AUTO COLLECT, CLEAR GAME",http://www.mediafire.com/file/ai2qwjz2jdxrhpy/file
254,A Bizarre Day NEW GUI WITH LOTS OF FEATURES,http://www.mediafire.com/file/ryinqxt0bq3q93v/file
255,"Mortem Metallum NEW FREE GUI, KILL AURA & MORE!",http://www.mediafire.com/file/di33j9rto0g9cz8/file
256,"Airport Tycoon AUTO COLLECT CASH, AUTO UPGRADE, ANTI AFK",http://www.mediafire.com/file/iq3eq3ylpq1tkwz/file
257,"2 Player Police Tycoon AUTO COLLECT CASH, AUTO UPGRADE & CLEAN GAME",http://www.mediafire.com/file/vcvg3hi2irxmxuf/file
258,Arsenal FREE GUN MODS,http://www.mediafire.com/file/cr5d9v9szx2vun4/file
259,"AREA 27 GUI , GET TOOLS , TELEPORTS , MORPHS",http://www.mediafire.com/file/bgo8uwvansprzrx/file
260,RO-Wizard AUTO FARM,http://www.mediafire.com/file/fh99b55qfr07gcv/file
261,Linkvertise Bypass [WEB BASED],
262,Destruction Simulator NEW GUI DESTROY ZONE AND LAG WHOLE SERVER + MORE!,http://www.mediafire.com/file/x78ittf3rz00q7g/file
263,"Football Fusion PREMIUM GUI [$10, 1.5K ROBUX] QB AIMBOT, FOOTBALL MAGNET AND MORE!",
264,PSU – Obfuscator api [Self-bot],
