0,LGBTQ+ Hangout 2 CSGO Clan Tag Style Name,http://www.mediafire.com/file/doz8hbghwfcwenp/file
156,Thunder Hub FREE HUB [4 GAMES],https://www.mediafire.com/file/hm2x6spgsfxkmpi/Thunder_Hub_FREE_HUB_%255B4_GAMES%255D.txt/file
157,"Project New World AUTO FARM, FRUIT GRABBER & MORE!",https://www.mediafire.com/file/t4eosfmf7uugja9/Project_New_World_AUTO_FARM%252C_FRUIT_GRABBER_%2526_MORE%2521.txt/file
158,BedWars GUI JUNE 2021,https://www.mediafire.com/file/kl03dlhdi9d9m4l/BedWars_GUI_JUNE_2021.txt/file
159,Your Bizarre Adventure INVISIBILITY & GOD MODE SCRIPT,https://www.mediafire.com/file/5x2vnjvhxxftj0d/Your_Bizarre_Adventure_INVISIBILITY_%2526_GOD_MODE_SCRIPT.txt/file
160,[FE] Arsenal ANNOYING MUSIC FE SCRIPT,https://www.mediafire.com/file/vufscvrxyu55mk6/%255BFE%255D_Arsenal_ANNOYING_MUSIC_FE_SCRIPT.txt/file
161,Rojutsu Blox AUTO FARM & ANY ABILITY SCRIPT,https://www.mediafire.com/file/4g5eko6r7ra2ftd/Rojutsu_Blox_AUTO_FARM_%2526_USE_ANY_ABILITY.txt/file
162,FRIEND EVERYONE IN YOUR GAME SCRIPT,https://www.mediafire.com/file/u7tk27li2rqw6nr/FRIEND_EVERYONE_IN_YOUR_GAME_SCRIPT.txt/file
163,Project New World NO DASH / GEPPO STAMINA DRAIN,https://www.mediafire.com/file/muyr11j7nb2cc3c/Project_New_World_NO_DASH_%252C_GEPPO_STAMMINA_DRAIN.txt/file
164,Ro: Infinite Zero AUTO KILL MOB & FREE VIP SERVERS,
165,Fall of Hell GUI JUNE 2021,https://www.mediafire.com/file/739biiqxu4bhmmj/Fall_of_Hell_GUI_JUNE_2021.txt/file
166,Field Trip Z GUI JUNE 2021 [NICE FEATURES],https://www.mediafire.com/file/8zlt49ffc36pa90/Field_Trip_Z_GUI_JUNE_2021_%255BNICE_FEATURES%255D.txt/file
167,Project new world AUTO FARM SCRIPT JUNE 2021,https://www.mediafire.com/file/gf65fsogn32pn77/Project_New_World_AUTO_FARM_SCRIPT_JUNE_2021.txt/file
168,Pet Pals GAME DESTROYING SCRIPTS,https://www.mediafire.com/file/n4y2fkyuxi1jfm6/Pet_Pals_AUTO_FARM.txt/file
169,Prison Life KEYCARD SNIPER [OPEN SOURCE],https://www.mediafire.com/file/57n5tfmylyw9pc1/Prison_Life_KEYCARD_SNIPER_%255BOPEN_SOURCE%255D.txt/file
170,"Rojutsu Blox AUTO FARM, AUTO QUEST & HIDE NAME",https://www.mediafire.com/file/rs2yx4ii0mkzs69/Rojutsuu_Blox_AUTO_FARM%252C_AUTO_QUEST_%2526_HIDE_NAME.txt/file
171,ROBLOX ANIMATION STEALER [IMPROVED],https://www.mediafire.com/file/mxsmxaso5nimmv6/ROBLOX_ANIMATION_STEALER_%255BIMPROVED%255D.txt/file
172,BedWars KILL AURA & MORE! GUI,https://www.mediafire.com/file/zw9yt8qq5urp0fx/BedWars_KILL_AURA_%2526_MORE%2521_GUI.txt/file
173,Sorky Hub FREE HUB [5 GAMES],https://www.mediafire.com/file/s795o456lslg4z2/Sorky_Hub_FREE_HUB_%255B5_GAMES%255D.txt/file
174,Project Lazarus: ZOMBIES AIMBOT SCRIPT,https://www.mediafire.com/file/d0p7rns4zrnbyhq/Project_Lazarus%253B_ZOMBIES_AIMBOT_SCRIPT.txt/file
175,"BedWars KILL AURA, ITEM AURA, ITEM & PLAYER ESP",https://www.mediafire.com/file/iniew35d5cleqpq/BedWar_KILL_AURA%252C_ITEM_AURA%252C_ITEM_%2526_PLAYER_ESP.txt/file
176,Stands Awakening AUTO FARM JUNE 2021,https://www.mediafire.com/file/vaviyg0tc5tkch1/Stands_Awakening_AUTO_FARM_JUNE_2021.txt/file
177,Rojutsu Blox AUTO QUEST,https://www.mediafire.com/file/6rillwrn8zn5eq3/Rojutsu_Blox_AUTO_QUEST.txt/file
178,"Rojutsu Blox UNDERGROUD FARM, AUTO QUEST & MORE! [OPEN SOURCE]",https://www.mediafire.com/file/gp66jeaoscet00r/Rojutsu_Blox_UNDERGROUND_FARM%252C_AUTO_QUEST_%2526_MORE%2521_%255BOPEN_SOURCE%255D.txt/file
179,Project New World AUTO SPAM SKILLS [OPEN SOURCE],https://www.mediafire.com/file/np7f21x68c5titt/Project_New_World_AUTO_SPAM_SKILLS_%255BOPEN_SOURCE%255D.txt/file
180,Project New World DEVIL FRUIT FARM – FASTEST FRUIT SNIPER [OPEN SOURCE],https://www.mediafire.com/file/t72smifebyokjy5/Project_New_World_DEVIL_FRUIT_FARM_-_FASTEST_FRUIT_SNIPER_%255BOPEN_SOURCE%255D.txt/file
181,"Your Bizarre Adventure INVISIBLE, INFINITE PILOT, GOD MODE & TP BYPASS [OPEN SOURCE]",https://www.mediafire.com/file/9xzs7sktyczoill/yba_infinite_pilot_range.txt/file
182,Untamed Planet AUTO FARM JUNE 2021,https://www.mediafire.com/file/vbctcwu7qii2lh8/Untamed_Planet_AUTO_FARM_JUNE_2021.txt/file
183,Counter Blox TRADE SERVER SCRIPT,https://www.mediafire.com/file/jeo47av0q4toexc/Counter_Blox_TRADE_SERVER_SCRIPT.txt/file
184,"Combat Warriors INF STAMINA, HITBOX EXPANDER & MORE! GUI",https://www.mediafire.com/file/oh3xo8u4gdyww7b/Combat_Warrior_INF_STAMINA%252C_HITBOX_EXPANDER_%2526_MORE%2521_GUI.txt/file
185,ZOぞ FASTER HITS SCRIPT,https://www.mediafire.com/file/bp6zgqadg2rl4mw/ZO_FASTER_HITS_SCRIPT.txt/file
186,Mad City INSTANT SERVER CRASHER JUNE 2021,https://www.mediafire.com/file/ycvucp8lkxc1i0q/Mad_City_INSTANT_SERVER_CRASHER_JUNE_2021.txt/file
187,BIG Paintball INFINITE NUKE & MODDED DEFAULT GUN,https://www.mediafire.com/file/bl46m8qrlcqdrba/Big_Paintball_MODDED_DEFAULT_GUN.txt/file
188,Anime Run BETA AUTO FARM JUNE 2021,https://www.mediafire.com/file/yf39fgruahv7cvk/Anime_Run_BETA_AUTO_FARM_JUNE_2021.txt/file
189,ROBLOX SWORD AURA SCRIPT – FOR SWORD FIGHTING GAMES ON ROBLOX,https://www.mediafire.com/file/dn4g4o9wxibskvt/ROBLOX_SWORD_AURA_SCRIPT_-_FOR_SWORD_FIGHTING_GAMES_ON_ROBLOX.txt/file
190,Project New World GET ALL SWORDS EVEN PAID ONES! [USE BEFORE PATCH],https://www.mediafire.com/file/o9ht1q0vm18mauj/Project_New_World_GET_ALL_SWORDS_EVEN_PAID_ONES%2521_%255BUSE_BEFORE_PATCH%255D.txt/file
191,Pet Swarm Simulator AUTO FARM JUNE 2021,https://www.mediafire.com/file/c6vrowc9wni4aju/Pet_Swarm_Simulator_AUTO_FARM_JUNE_2021.txt/file
192,BIG Paintball INFINITE COINS SCRIPT JUNE 2021,https://www.mediafire.com/file/5zitniup43iesc1/BIG_Paintball_INFINITE_COINS_SCRIPT_JUNE_2021.txt/file
193,ZOぞ ANTI CHEAT BYPASS & HITBOX EXPANDER BONUS SCRIPT,https://www.mediafire.com/file/8paawvwy175cwhy/ZO_HITBOX_EXPANDER_.txt/file
194,Shed Bypasser V3 – #1 ROBLOX CHAT BYPASS TOOL – AUTO BYPASS – CUSTOM CHAT SUPPORT,
195,Impostor IMPOSTOR CHECK,https://www.mediafire.com/file/ob1zbric7uip2if/Impostor_IMPOSTOR_CHECK.txt/file
196,Ro: Infinite Zero AUTO FARM JUNE 2021,https://www.mediafire.com/file/feo2o4v1riselos/Ro%253B_Infinite_Zero_AUTO_FARM_JUNE_2021.txt/file
197,ROBLOX GYRO AIMBOT SCRIPT [FREE],https://www.mediafire.com/file/no9atzm5mycgdug/ROBLOX_GYRO_AIMBOT_SCRIPT_%255BFREE%255D.txt/file
198,ROBLOX ANTI FLING SCRIPT [FREE],https://www.mediafire.com/file/sqg7x0aflmfryq6/ROBLOX_ANTI_FLING_SCRIPT_%255BFREE%255D.txt/file
199,Murder Mystery 2 AUTO BOOMBOX SCRIPT,https://www.mediafire.com/file/9j95656j39e7tx2/Murder_Mystery_2_AUTO_BOOMBOX_SCRIPT.txt/file
200,Project New World AUTO FARM FRUITS WITH SERVER HOP [OPEN SOURCE],https://www.mediafire.com/file/qz6llslkcbd1q6r/Project_New_World_AUTO_FARM_FRUITS_WITH_SERVER_HOP_%255BOPEN_SOURCE%255D.txt/file
201,Cooking Simulator INFINITE GEMS & PLACE POTS INTO FOOD AREA SCRIPT,https://www.mediafire.com/file/1vderka90u7qc4u/Cooking_Simulator_PLACE_POTS_INTO_FOOD_AREA.txt/file
202,Blox Fruits AUTO LEVEL FARM & MORE! JUNE 2021,https://www.mediafire.com/file/5zc8dvmwr8n7fdn/Blox_Fruits_AUTO_LEVEL_FARM_%2526_MUCH_MORE%2521_JUNE_2021.txt/file
203,BKHAXHUB FREE SCRIPT HUB – ANIME GAMES – 5 GAMES,https://www.mediafire.com/file/ftw48mg9d2tsn72/BKHAXHUB_%255B5_GAMES%255D.txt/file
204,ROBLOX EMOTE INVENTORY EDITOR [UPDATED],https://www.mediafire.com/file/wrcoi4ex0cipzh5/ROBLOX_EMOTE_INVENTORY_EDITOR_.txt/file
205,"Project New World AUTO FARM, AUTO BUSO, SUPER SWORD & MORE!",https://www.mediafire.com/file/76qevjraa1n64uu/Project_New_World_AUTO_FARM%252C_AUTO_BUSO%252C_SUPER_SWORD_%2526_MORE%2521.txt/file
206,Randomly Generated Droids CLASSES SCRIPT,https://www.mediafire.com/file/k0w3zmgncx4pw8u/Randomly_Generated_Droids_CLASSES_SCRIPT.txt/file
207,Pornhub UI Library JUNE 2021,https://www.mediafire.com/file/44du21o93tv2lkk/Pornhub_UI_Library_JUNE_2021.txt/file
208,"Project XL v4.0 AUTO MOBS, AUTO QUEST, AUTO EQUIP & ATTACK!",https://www.mediafire.com/file/vws5obgtbssf3eu/Project_XL_V4.0_AUTO_MOBS%252C_AUTO_QUEST%252C_AUTO_EQUIP_%2526_ATTACK.txt/file
209,Rojutsu Blox PATRICK HUB AUTO FARM & MORE!,https://www.mediafire.com/file/n7h8zch38fj4yw9/Patricks_Hub.txt/file
210,Hunting Season V0.1.8 NIGHT CRAWLER AUTO FARM,https://www.mediafire.com/file/mryirb45zj3zb5u/Hunting_Season_V0.1.8_NIGHT_CRAWLER_AUTO_FARM.txt/file
211,stay alive and steal time from others ANTI CHEAT BYPASS & GOD MODE,https://www.mediafire.com/file/4zoucbj79a4o8fd/stay_alive_and_steal_time_from_others_ANTI_CHEAT_BYPASS_%2526_GOD_MODE.txt/file
212,Magic Show ITEM GIVER GUI,https://www.mediafire.com/file/bodt6xmjpinke99/Magic_Show_ITEM_GIVER_GUI.txt/file
213,Project New World AUTO FARM CHESTS WITH SERVER HOP [OPEN SOURCE] FIXED,https://www.mediafire.com/file/p8twqhywz363tfh/Project_New_World_AUTO_FARM_CHESTS_WITH_SERVER_HOP_%255BOPEN_SOURCE%255D_FIXED.txt/file
214,Build A Boat For Treasure OP AUTO FARM JUNE 2021,https://www.mediafire.com/file/qpttloek9v1jd8w/Build_a_boat_for_treasure_OP_AUTO_FARM_JUNE_2021.txt/file
215,Murder Party SERVERSIDE ANNOUNCEMENT & COLLECT ALL COINS,https://www.mediafire.com/file/16mkhy5eu8xmheo/Murder_Party_ANNOUNCEMENT_%2526_COLLECT_ALL_COINS.txt/file
216,Treasure Quest AUTO COMPLETE DUNGEON [WORKS ON LATEST UPDATE],https://www.mediafire.com/file/d2kv6rqpb2t21t5/Treasure_Quest_AUTO_COMPLETE_DUNGEON_%255BWORKS_ON_LATEST_UPDATE%255D.txt/file
217,INFINITY RPG ANTI CHEAT BYPASS [INCLUDES FLY],https://www.mediafire.com/file/gix4fle6tkd1tjs/INFINITY_RPG_ANTI_CHEAT_BYPASS_%255BINCLUDES_FLY%255D.txt/file
218,Border Roleplay The Grand Crossing AUTO FARM JUNE 2021,https://www.mediafire.com/file/c9mrn73a93cnmwb/Border_Roleplay_The_Grand_Crossing_AUTO_FARM_JUNE_2021.txt/file
219,Project New World CHEST & DEVIL FRUIT AUTO FARM,https://www.mediafire.com/file/htnxv0x5wwwpuve/Project_New_World_CHEST_%2526_DEVIL_FRUIT_AUTO_FARM.txt/file
220,Hunting Season INFINITE STAMINA & FIXED AUTO FARM,https://www.mediafire.com/file/nl7abab5yehv51r/Hunting_Season_INFINITE_STAMINA_.txt/file
221,Magic Show INFINITE MONEY,https://www.mediafire.com/file/cbigtqmkqgeaza5/Magic_Show_INFINITE_MONEY.txt/file
222,"Your Bizarre Adventure FULL AUTO FARM, TP ITEM & GOD MODE GUI! JUNE 2021",https://www.mediafire.com/file/br75ezn8k02gixc/Your_Bizarre_Adventure_FULL_AUTO_FARM%252C_TP_ITEM_%2526_GOD_MODE_GUI%2521_JUNE_2021.txt/file
223,Aqualiana Water park INFINITE COIN FARM,https://www.mediafire.com/file/ngt27w0c3i5go2m/Aqualiana_Water_Park_INFINITE_COIN_FARM.txt/file
224,Oil Warfare Tycoon KILL ALL,https://www.mediafire.com/file/x54hlhzsz3d7w3z/Oil_Warfare_Tycoon_KILL_ALL.txt/file
225,"Backpacking ADMIN GUI, ALL SERVERSIDE FUNCTIONS JUNE 2021",https://www.mediafire.com/file/obahaph8c817emc/Backpacking_ADMIN_GUI%252C_ALL_SERVERSIDE_FUNCTIONS_JUNE_2021.txt/file
226,De Pride Isle Sanatorium GUI WITH OP FEATURES JUNE 2021,https://www.mediafire.com/file/s5szb90hdg3os6b/De_Pride_Isle_Sanatorium_GUI_WITH_OP_FEATURES_JUNE_2021.txt/file
227,Backpacking NEW UPDATED ADMIN GUI [OLD ONE GOT PATCHED],https://www.mediafire.com/file/8u5x4eafq5p46it/Backpacking_NEW_UPDATED_ADMIN_GUI_%255BOLD_ONE_GOT_PATCHED%255D.txt/file
228,Spellbound RPG GET RANDOM ALL DAILY ITEM [GAMEPASS FOR FREE],https://www.mediafire.com/file/2njdehi6wxkvzw9/Spellbound_RPG_GET_RANDOM_ALL_DAILY_ITEMS_%2526_GAMEPASS_FOR_FREE.txt/file
229,Ninja Legends GUI UNLOCK ALL ELEMENTS,https://www.mediafire.com/file/ejasy9wjmjqxq6z/Ninja_Legends_GUI_UNLOCK_ALL_ELEMENTS.txt/file
230,Anomic ANTI CHEAT BYPASS [FLY & MORE],https://www.mediafire.com/file/pa8mmpj9enoddt3/Anomic_ANTI_CHEAT_BYPASS_%255BFLY_%2526_MORE%255D.txt/file
231,Jailbreak TELEPORT API [OPEN SOURCE],https://www.mediafire.com/file/uykawhds7xx91ek/Jailbreak_TELEPORT_API_%255BOPEN_SOURCE%255D.txt/file
232,"Anime Fighters Simulator GUI, WORLD TELEPORTS & MORE!",https://www.mediafire.com/file/e8epdj3d0to0a47/Anime_Fighters_Simulator_GUI%252C_WORLD_TELEPORTS_%2526_MORE%2521.txt/file
233,"SharkBite GUI, FE DELETE TOOL, KICK PLAYERS, SHUTDOWN SERVER & MORE!",https://www.mediafire.com/file/rln4hfvqkhxyknr/SharkBite_GUI%252C_FE_DELETE_TOOL_%2526_MORE%2521.txt/file
234,Wisteria AUTO RUN,https://www.mediafire.com/file/sbhwvyk1y2pgpfy/Wisteria_AUTO_RUN.txt/file
235,ZOぞ LEGIT AUTO ATTACK-ISH SCRIPT,https://www.mediafire.com/file/b8jxa1i3mbyqk1v/ZO_LEGIT_AUTO_ATTACK_SCRIPT.txt/file
236,Project XL AFK AUTO FARM & AUTO ABILITY FARM,https://www.mediafire.com/file/9ud9p8k7ze8f3qi/Project_XL_AUTO_ABILITY_FARM.txt/file
237,Murder Mystery 2 FREE XBOX ITEM & SERVER LAG / CRASH SCRIPT,https://www.mediafire.com/file/cyb4awaf0d4lfzr/Murder_Mystery_2_SERVER_LAG%252C_CRASH_SCRIPT.txt/file
238,"Fates ESP – UNIVERSAL ESP, AIMBOT & SILENT AIM",https://www.mediafire.com/file/6dap3nxj9zdomw4/Fates_ESP_-_UNIVERSAL_ESP%252C_AIMBOT_%2526_SILENT_AIM.txt/file
239,World Zero GUI WITH NICE FEATURES [SUPPORTS 4 CLASSES],
240,Plane Crazy GUI V1 – LAG SERVER 40K+ PING,https://www.mediafire.com/file/1n6ybo97qkjwnrs/Plane_Crazy_GUI_V1.txt/file
241,Aimblox BETA BIGGER BALLS SCRIPT,https://www.mediafire.com/file/sur9kk1svp9qnca/Aimblox_BETA_BIGGER_BALLS_SCRIPT.txt/file
242,"EL PASO, BORDER PATROL ROLEPLAY V2 MAP & SCRIPTS LEAK JUNE 2021",https://www.mediafire.com/file/an89i9w2j17p11u/el_paso_v1.5.rbxl/file
243,2 Player Among Us Tycoon INFINITE MONEY,https://www.mediafire.com/file/unr0g278erqttyo/2_Player_Among_Us_Tycoon_INFINITE_MONEY.txt/file
244,Tropical Resort Tycoon AUTO COLLECT CASH & MORE!,https://www.mediafire.com/file/14017y06k96ryon/Tropical_Resort_Tycoon_AUTO_COLLECT_CASH_%2526_MORE%2521.txt/file
245,Dream Island Tycoon AUTO COLLECT CASH & MORE!,https://www.mediafire.com/file/q28llgac048dkza/Dream_Island_Tycoon_AUTO_COLLECT_CASH_%2526_MORE%2521.txt/file
246,Goradiel Rpg – 4: Remastered INSTA KILL & AUTO FARM,https://www.mediafire.com/file/hn335kyr41l5nw8/Goradiel_RPG_-_4%253B_Remastered_INSTA_KILL_%2526_AUTO_FARM.txt/file
247,Blox Fruits INSTANT FRUIT FINDER & CHEST FARM,https://www.mediafire.com/file/b5b512sspfuvqzc/Blox_Fruits_INSTANT_FRUIT_FINDER_%2526_CHEST_FARM_NONSERVERHOP_VERSION.txt/file
248,Phantom Forces CHAMS SCRIPT JUNE 2021 [OPEN SOURCE],https://www.mediafire.com/file/dmrf8xhtspnuzuk/Phantom_Forces_CHAMS_SCRIPT_JUNE_2021_%255BOPEN_SOURCE%255D.txt/file
249,Teethyz Dentist SERVER LAGGER & FREE PET / INFINITE CASH SCRIPT,https://www.mediafire.com/file/e3md7zekx96nokt/Teethyz_Dentist_FREE_PET_AND_INFINITE_CASH.txt/file
250,Noob Army Tycoon KILL ALL TROOPS & MORE!,https://www.mediafire.com/file/tk2869njcqzuv7x/Noob_Army_Tycoon_KILL_ALL_TROOPS_%2526_MORE%2521.txt/file
251,Nullware Hub V2 – #1 REANIMATION HUB FOR ROBLOX – FREE,
252,Anime Fighters Simulator MOB FARM,https://www.mediafire.com/file/n5v7t1nx8tueizt/Anime_Fighters_Simulator_MOB_FARM.txt/file
253,SoulShatters Test Place AUTO BLOCK,https://www.mediafire.com/file/mg7p9p7mnqouoot/SoulShatters_Test_Place_AUTO_BLOCK.txt/file
254,Counter Blox HVH SCRIPT [OPEN SOURCE] V1 TAP,https://www.mediafire.com/file/xcukid3ek9wwlfx/Counter_Blox_HVH_SCRIPT_%255BOPEN_SOURCE%255D_V1_TAP.txt/file
255,Knife Simulator AUTO FARM JUNE 2021,https://www.mediafire.com/file/2uef69w91nbdl1x/Knife_Simulator_AUTO_FARM_JUNE_2021.txt/file
256,Randomizer (V.0.1.5c) LOOP KILL ALL,https://www.mediafire.com/file/9arl450cyn2fa3o/Randomizer_HIDE_YOURSELF.txt/file
257,Noob Army Tycoon UNLIMITED MONEY SCRIPT JUNE 2021,https://www.mediafire.com/file/hx2xnliv2j2f8r0/Noob_Army_Tycoon_UNLIMITED_MONEY_SCRIPT_JUNE_2021.txt/file
258,Jojo Odd Journey NUKE / EXPLODE SERVER SCRIPT [1K+ PLAYERS],https://www.mediafire.com/file/s27ubh12zluqnpk/Jojo_Odd_Journey_NUKE%252C_EXPLODE_SERVER_SCRIPT_.txt/file
259,Anime Fighters Simulator AUTO FARM JUNE 2021,https://www.mediafire.com/file/071eiiwdnxd7w28/Anime_Fighter_Simulator_AUTO_FARM_JUNE_2021.txt/file
260,"Rojutsu Blox GAIN+ HUB – FARM ALL, GOD MODE & MORE!",https://www.mediafire.com/file/zahgi2n3geb95ug/Gain%252B_Hub_ROJUTSU_BLOX.txt/file
261,"Advanced Fighter EX UNLIMITED XP, ADMIN POKEMON & MORE!",https://www.mediafire.com/file/a836euamhulsbnj/Advanced_Fighter_EX_ADMIN_POKEMON.txt/file
262,"The Undead Coming (BETA) GUI, INFINITE AMMO, KILL ALL ZOMBIES, ZOMBIE AURA & MORE!",https://www.mediafire.com/file/6u4k7pf10ah4x2n/The_Undead_Coming_BETA_GUI.txt/file
263,Phantom Forces CUSTOMIZABLE ARM CHAMS [OPEN SOURCE],https://www.mediafire.com/file/54g8nc5wk9us5vp/Phantom_Forces_CUSTOMIZABLE_ARM_CHAMS_%255BOPEN_SOURCE%255D.txt/file
264,Rogue Lineage FULL CLIENT BYPASS JUNE 2021,
265,Phantom Forces PF-PETER – NEW CHEAT FOR PF – 2 VERSIONS & FREE!,https://gist.githubusercontent.com/Skribb11es/50e3ad7172d931b99bb09f362fd80825/raw/c9fabe5c7eafc030dc3bd51ad67c4ab197d52e1c/PF-PETERV2.lua
266,Oil Warfare Tycoon CHILLHUB GUI,https://www.mediafire.com/file/cm44mvojukko9yd/Oil_Warfare_Tycoon_CHILLHUB_GUI.txt/file
267,"Anime Fighters Simulator AUTO COLLECT DROPS, DAMAGE BOOST & AUTO BUY EGG GUI",https://www.mediafire.com/file/ad3zn1kagd68s08/Anime_Fighers_Simulator_SIMPLE_GUI.txt/file
268,Anime Fighters Simulator AUTO FARM GUI,https://www.mediafire.com/file/p20ow1tl43om8x3/Anime_Fighters_Simulator_AUTO_FARM_GUI.txt/file
269,Dinosaur City Simulator FREE VIP SCRIPT,https://www.mediafire.com/file/kva7zyalqfe2n7f/Dinosaur_City_Simulator_FREE_VIP_SCRIPT.txt/file
270,"Anime Fighters Simulator AUTO FARM, COLLECT COINS, OPEN EGGS & AUTO DELETE",https://www.mediafire.com/file/8qsg02nfg89kgy0/Anime_Fighters_Simulator_AUTO_FARM%252C_COLLECT_COINS_%2526_MORE%2521.txt/file
271,"TPS: Ultimate Soccer INF STAMINA, SPEED & MORE GUI!",https://www.mediafire.com/file/68rf2p8d32o1amu/TPS%253B_Ultimate_Soccer_INF_STAMINA%252C_SPOOF_LEVEL_%2526_MORE_GUI%2521.txt/file
272,Sacrifice Sanctuary TROLL PLAYERS & CRASH SERVER SCRIPT,https://www.mediafire.com/file/olccc0y8g7jkinp/Sacrifice_Sanctuary_CRASH_SERVER_SCRIPT.txt/file
273,Project XL v4.3 KILL AURA JUNE 2021,https://www.mediafire.com/file/c7orpqjhy75stsm/Project_XL_KILL_AURA_JUNE_2021.txt/file
274,Snow Hub – PREMIUM FREE SCRIPT HUB – 10+ GAMES & UNIVERSAL,https://discord.gg/2T8R3D5q5d
275,"Star Wars Bounty Hunters: Outer Rim KILL ALL, INFINITY CREDITS & KILL ALL BOUNTIES",https://www.mediafire.com/file/jg9oexohbps9x9y/Star_Wars_Bounty_Hunters%253B_Outer_Rim_KILL_ALL%252C_INFINITY_CREDITS_%2526_KILL_ALL_BOUNTIES.txt/file
276,JoJo Tycoon (BETA) AUTO FARM & MORE!,https://www.mediafire.com/file/m5k5dxmi3m4ixfv/Jojo_Tycoon_%2528BETA%2529_AUTO_FARM_%2526_MORE%2521.txt/file
277,"Make a Cake: Back for Seconds AUTO PLAYER, AUTO GRABBER & AUTO OBBY",https://www.mediafire.com/file/5b1ucl9yrjsiqoo/Make_a_Cake%253B_Back_for_Seconds_AUTO_PLAYER%252C_AUTO_GRABBER_%2526_AUTO_OBBY.txt/file
278,Lucky Blocks Battlegrounds 800 ROBUX GEAR FREE SCRIPT,https://www.mediafire.com/file/rmloc5neqzwbnyh/Lucky_Blocks_Battlegrounds_800_ROBUX_GEAR_FREE_SCRIPT.txt/file
279,ROBLOX CUSTOM CHAT – CHAT ENHANCER,https://www.mediafire.com/file/6aqqub2odu14u0p/ROBLOX_CUSTOM_CHAT_-_CHAT_ENHANCER.txt/file
280,Naruto:Tragedy AUTO FARM & INF CHAKRA,https://www.mediafire.com/file/4490uv45vrr1eea/Naruto%253B_Tragedy_AUTO_FARM_%2526_INF_CHAKRA.txt/file
281,"Project: XL RACE, BAG & MENTOR AUTO FARM",https://www.mediafire.com/file/v8xqaowouta59ww/Project%253B_XL_MENTOR_AUTO_FARM.txt/file
282,Piggy GUI – OP FEATURES! JUNE 2021,https://www.mediafire.com/file/apt9d81bmxdu1kv/Piggy_GUI_-_OP_FEATURES%2521_JUNE_2021.txt/file
283,Minerscave AUTO MINE,https://www.mediafire.com/file/f50qa9j9ikrpfzd/Minerscave_AUTO_MINE.txt/file
284,"The Wild West YEEHAW GUI, LOTS OF OP FEATURES!",https://www.mediafire.com/file/awmybce3nk1ozpl/The_Wild_West_YEEHAW_GUI%252C_LOTS_OF_OP_FEATURES.txt/file
285,Trade Tower AUTO CLICKER,https://www.mediafire.com/file/afil1ywompb8ujk/Trade_Tower_AUTO_CLICKER.txt/file
286,Rojutsu Blox INSTA KILL AURA,https://www.mediafire.com/file/m7i8ofyo6ptbhli/Rojutsu_Blox_INSTA_KILL_AURA.txt/file
287,Dragon’s Fire GET GAMEPASS DRAGON FREE [1K ROBUX PASS FOR FREE],https://www.mediafire.com/file/a4i2gf03jf9b0ef/Dragon%2527s_Fire_GET_1K_GAMEPASS_FREE.txt/file
288,"Wacky Wizards GUI, USE ALL ITEMS & MORE!",https://www.mediafire.com/file/dsahakfx53mq3a4/Wacky_Wizards_GUI%252C_USE_ALL_ITEMS_%2526_MORE%2521.txt/file
289,"Project: XL AUTO FARM MONEY, RACE, BAG & MENTOR GUI JUNE 2021",https://www.mediafire.com/file/f33hd8qro9nsz5g/Project%253B_XL_AUTO_FARM_GUI_JUNE_2021.txt/file
290,Farm Tycoon AUTO FARM,https://www.mediafire.com/file/8hl6p37s7d6wf3k/Farm_Tycoon_AUTO_FARM.txt/file
291,All Star Tower Defense AUTO MERLIN LOOP,https://www.mediafire.com/file/m8ifk5oqlyomsnn/All_Star_Tower_Defense_AUTO_MERLIN_LOOP.txt/file
292,City Life Tycoon AUTO FARM & AUTO UPGRADE GUI,https://www.mediafire.com/file/fqhxpgpyhirtuyi/City_Life_Tycoon_AUTO_FARM_%2526_AUTO_UPGRADE_GUI.txt/file
293,Rojutsu Blox VEP’S AUTO FARM GUI FIXED JUNE 2021,https://www.mediafire.com/file/y1vfetr1ycff941/Rojutsu_Blox_VEP%2527S_AUTO_FARM_GUI_FIXED_JUNE_2021.txt/file
294,REDEEM CODES SCRIPT [WORKS FOR 3 GAMES],https://www.mediafire.com/file/ywxrddno8rjrc7q/REDEEM_CODES_SCRIPT_%255BWORKS_FOR_3_GAMES%255D.txt/file
295,Project XL v4.3 MAGNET AUTO FARM,https://www.mediafire.com/file/068dkazxtn08vbk/Project_XL_v4.3_MAGNET_AUTO_FARM.txt/file
296,An Infinite Adventure DARK EXPLODE / NUKE SERVER,https://www.mediafire.com/file/wkpjqvqpq3k0obz/An_Infinite_Adventure_DARK_EXPLODE%252C_NUKE_SERVER.txt/file
297,Razor Admin SERVER SIDE SCRIPT OPEN SOURCE,https://www.mediafire.com/file/8vo0qofubym5le9/Razor_Admin_SERVER_SIDE_SCRIPT_OPEN_SOURCE.txt/file
298,Gun Dealer Tycoon AFK FARM [OPEN SOURCE],https://www.mediafire.com/file/m5dl7m991me743m/Gun_Dealer_Tycoon_AFK_FARM_%255BOPEN_SOURCE%255D.txt/file
299,Steve’s one piece 2 ANTI TP BYPASS & ANTI LOGGER,https://www.mediafire.com/file/1rn4bcmn9xpyq7k/Steve%2527s_One_Piece_2_ANTI_TP_BYPASS_%2526_ANTI_LOGGER.txt/file
300,"Midnight Racing: Tokyo AUTO FARM MONEY, LEVEL & LAPS",https://www.mediafire.com/file/crs586fl628i1l0/Midnight_Racing%253B_Tokyo_AUTO_FARM_MONEY%252C_LEVEL_%2526_LAPS.txt/file
301,KAT AUTO FARM JUNE 2021,https://www.mediafire.com/file/z7tjbjo0wxbpn67/KAT_AUTO_FARM_JUNE_2021.txt/file
302,Prison Tycoon INFINITE MONEY SCRIPT,https://www.mediafire.com/file/dp2a7col4h1o01n/Prison_Tycoon_INFINITE_MONEY_SCRIPT.txt/file
303,"Club Roblox FREE LEGENDARIES, RARE ITEMS GUI",https://www.mediafire.com/file/md1gngk54gae5oq/Club_Roblox_FREE_LEGENDARIES_%2526_RARE_ITEMS_GUI.txt/file
304,"Speed Run Simulator FORCE TRADE, UNLOCK TRAILS, BEST PET & ADMIN PET GUI",https://www.mediafire.com/file/mmvxhjaysv0yd9z/Speed_Run_Simulator_FORCE_TRADE%252C_UNLOCK_TRAILS%252C_BEST_PET_%2526_ADMIN_PET_GUI%255D.txt/file
305,SCDESECURE – STREAM SECURE SCRIPT – OPEN SOURCE,https://www.mediafire.com/file/7gu8ych0bukmgyo/SCDESECURE_-_STREAM_SECURE_SCRIPT_-_OPEN_SOURCE.txt/file
306,Lifting Simulator AUTO FARM GUI JUNE 2021,https://www.mediafire.com/file/hcnjxu3wl40wv9i/Lifting_Sim_AUTO_FARM_GUI_JUNE_2021.txt/file
307,Car Hub FREE HUB FOR CAR GAMES [6 GAMES],https://discord.gg/JrkJFJXtcS
308,Rojutsu Blox LIOK HUB,https://www.mediafire.com/file/32oico9yjlomvhc/Rojutsu_Blox_LIOK_HUB.txt/file
309,surf SURFHAXX,https://www.mediafire.com/file/4fo2ul2l8sxaqnj/Surf_SURFHAXX.txt/file
310,"Shonen Verse GUI, AUTO FARM & AUTO QUEST",https://www.mediafire.com/file/bu5k3tm3qjpujus/Shonen_Verse_GUI%252C_AUTO_FARM_%2526_AUTO_QUEST.txt/file
311,find ways to die INFINITE MONEY,https://www.mediafire.com/file/igzo1dzgepyjlvh/find_ways_to_die_INFINITE_MONEY.txt/file
312,Strongman Simulator AFK ENERGY & STRENGTH FARMING,https://www.mediafire.com/file/yx0llqi28ly2jcm/Strongman_Simulator_AFK_ENERGY_%2526_STRENGTH_FARMING.txt/file
313,Murder Mystery 3 AUTO FARM COINS,https://www.mediafire.com/file/hbbbxjeh1wypc8p/Murder_Mystery_3_AUTO_FARM_COINS_JUNE_2021.txt/file
314,Stepford County Railway AUTO DRIVE GUI,https://www.mediafire.com/file/0qa993jag37l4vb/Stepford_County_Railway_AUTO_DRIVE_GUI.txt/file
315,Potato Hub [9 GAMES] FREE,https://www.mediafire.com/file/mx7tw0eiajco35a/Potato_Hub_%255B9_GAMES%255D_FREE.txt/file
316,"Coin Hero Simulator GUI, AUTO FARM, AUTO HATCH EGGS & MORE!",https://www.mediafire.com/file/ya7ozfjvebgtpse/Coin_Hero_Simulator_GUI%252C_AUTO_FARM%252C_AUTO_HATCH_EGGS_%2526_MORE%2521.txt/file
317,Q-Clash SILENT AIM GUI,https://www.mediafire.com/file/g6yt5hneyicg3tw/Q-Clash_SILENT_AIM_GUI.txt/file
318,Shonen Verse AUTO FARM WITH AUTO QUEST,https://www.mediafire.com/file/0t8sd262tv4txfp/Shonen_Verse_AUTO_FARM_WITH_AUTO_QUEST.txt/file
319,Planet Mining Simulator AUTO FARM GUI JUNE 2021,
320,"Egg Farm Simulator AUTO FARM, CHICKEN AUTO KILL & EGG AUTO PICKUP",https://www.mediafire.com/file/stnslzqrd499giu/Egg_Farm_Simulator_AUTO_FARM%252C_CHICKEN_AUTO_KILL_%2526_EGG_AUTO_PICKUP.txt/file
321,Treasure Quest SIMPLE AUTO FARM [OPEN SOURCE],https://www.mediafire.com/file/r4kf5uunq2fc69b/Treasure_Quest_SIMPLE_AUTO_FARM_%255BOPEN_SOURCE%255D.txt/file
322,"War Simulator GUN MODS, AUTO FARM & MORE!",https://www.mediafire.com/file/ev7ahb3n7dr4tmi/war_sim_autofarm.lua/file
323,Stranger Things: Starcourt Mall INFINITE COINS AUTO FARM,https://www.mediafire.com/file/q6hx58yz91940xd/Stranger_Things%253B_Starcourt_Mall_INFINITE_COINS_AUTO_FARM.txt/file
324,Ultimate Random Night 0.8.8 PLAY AMONG US AUDIO WHEN SOMEONE SAYS AMONG US,https://www.mediafire.com/file/5677890kpkkt81f/Ultimate_Random_Night_0.8.8_PLAY_AMONG_US_WHEN_SOMEONE_SAYS_AMONG_US.txt/file
325,Hide and Seek Extreme CATCH EVERYONE & TELEPORT TO SPAWN GUI,https://www.mediafire.com/file/93ycl8e1x6jx6ar/Hide_and_Seek_Extreme_CATCH_EVERYONE_%2526_TELEPORT_TO_SPAWN_GUI.txt/file
326,"RAGDOLL UNIVERSE ESP, SILENT AIM & AIMBOT",https://www.mediafire.com/file/xu7uw6yrsxrrtuh/RAGDOLL_UNIVERSAL_ESP%252C_SILENT_AIM_%2526_AIMBOT.txt/file
327,Nuke Site DETONATE NUKE GUI,https://www.mediafire.com/file/scz3upn4zi1oyhn/Nuke_Site_DETONATE_NUKE.txt/file
328,"ZOぞ GUI JUNE 2021, ESP – SAFEZONE – & MORE!",https://www.mediafire.com/file/69h1b62ibi1cm9v/ZO_GUI_.txt/file
329,ゼノオンライン NO COMBAT LOG SCRIPT,https://www.mediafire.com/file/8woyckpvycqar52/%25E3%2582%25BC%25E3%2583%258E%25E3%2582%25AA%25E3%2583%25B3%25E3%2583%25A9%25E3%2582%25A4%25E3%2583%25B3__NO_COMBAT_LOG_SCRIPT.txt/file
