0,LGBTQ+ Hangout 2 CSGO Clan Tag Style Name,http://www.mediafire.com/file/doz8hbghwfcwenp/file
102,Your Bizarre Adventure WEAR ANY COSMETIC,https://www.mediafire.com/file/ro0fnwt4nuwc9gu/Your_Bizarre_Adventure_WEAR_ANY_COSMETIC.txt/file
103,"Project XL v3.4 GUI, BRING DEVIL FRUITS & MORE!",https://www.mediafire.com/file/pqpffvbozmh4vbi/Project_XL_V3.4_GUI%252C_BRING_DEVIL_FRUITS_%2526_MORE%2521.txt/file
104,ROBLOX BOX ESP WITH HEALTH BARS [OPEN SOURCE],https://www.mediafire.com/file/7shjh2pw7qc6tom/ROBLOX_BOX_ESP_WITH_HEALTH_BARS_%255BOPEN_SOURCE%255D.txt/file
105,[FE] LOOP KILL ALL [NEED 10 TOOLS OR MORE],https://www.mediafire.com/file/iblg4fenkdcrz1j/%255BFE%255D_LOOP_KILL_ALL.txt/file
106,A Hero’s Destiny AUTO TRAIN,https://www.mediafire.com/file/x9stc9blxpn485e/A_Hero%2527s_Destiny_AUTO_TRAIN.txt/file
107,Survival Among Us Impostor The Killer GUI 2021,https://www.mediafire.com/file/yxiatts0caved00/Survival_Among_Us_Impostor_The_Killer_GUI_2021.txt/file
108,Tatakai Reborn AUTO ROLL,https://www.mediafire.com/file/4bjivaawgvmi9r0/Tatakai_Reborn_AUTO_ROLL.txt/file
109,Hoops – Demo GUI MARCH 2021,https://www.mediafire.com/file/vs1ltcnhqtkrvl4/Hoops_-_Demo_GUI_MARCH_2021.txt/file
110,ROBLOX SKELETON ESP [OPEN SOURCE],https://www.mediafire.com/file/5oqpvf3fl9erl6l/ROBLOX_SKELETON_ESP_%255BOPEN_SOURCE%255D.txt/file
111,Dragon Ball Final Remastered DRAGON BALLS SERVERSHOP FARM,https://www.mediafire.com/file/p4zchu0tlcuoj2h/Dragon_Ball_Final_Remastered_DRAGON_BALLS_SERVERHOP_FARM.txt/file
112,The Turbulent Seas STEAL FURNITURE,https://www.mediafire.com/file/a0annkpidvbe9n6/The_Turbulent_Seas_STEAL_FURNITURE.txt/file
113,Dragon Ball Final Remastered VANISH NO COOLDOWN,https://www.mediafire.com/file/14pdfzt1hsr3zld/Dragon_Ball_Final_Remastered_VANISH_NO_COOLDOWN.txt/file
114,REV// PUBLIC BETA AUTO FARM [OPEN SOURCE],https://www.mediafire.com/file/j12psbgadjh3vde/REV_PUBLIC_BETA_AUTO_FARM_%255BOPEN_SOURCE%255D.txt/file
115,Exotic Craftwars MONEY SCRIPT,https://www.mediafire.com/file/yr7qyx6e553u397/Exotic_Craftwars_MONEY_SCRIPT.txt/file
116,Shindo Life NO CD METHOD & BLIND SERVER,https://www.mediafire.com/file/ko4luxsigtm3nus/Shindo_Life_NO_CD_METHOD_%2526_BLIND_SERVER_SCRIPT.txt/file
117,Project XL DELETE ITEMS FROM YOUR INVENTORY,https://www.mediafire.com/file/tkyfz0w2pkls4du/Project_XL_DELETE_ITEMS_FROM_YOUR_INVENTORY.txt/file
118,Border Roleplay The Grand Crossing POTATOX GUI,https://www.mediafire.com/file/owt3c2upg3xe0ne/Border_Roleplay_The_Grand_Crossing_POTATOX_GUI.txt/file
119,Dragon Ball Warriors AUTO FARM BROLY,https://www.mediafire.com/file/ey460kjuwspg6sv/Dragon_Ball_Warriors_AUTO_FARM_BROLY.txt/file
120,Ultimate Tower Defense Simulator SAVE AND LOAD SETUPS,https://www.mediafire.com/file/mnno22xt4umkzmt/Ultimate_Tower_Defense_Sim_SAVE_AND_LOAD_SETUPS.txt/file
121,Red vs Blue Gun Battle SPAM KILL EVERYONE,https://www.mediafire.com/file/2ixx60uf3tjfydo/Red_vs_Blue_Gun_Battle_SPAM_KILL_EVERYONE.txt/file
122,Rogue Lineage SCROLL ROULETTE BOT,https://www.mediafire.com/file/9oz88123iwjah83/Rogue_Lineage_SCROLL_ROULETTE_BOT.txt/file
123,ROBLOX ANTI IP LOGGER SCRIPT,https://www.mediafire.com/file/cmsopj1k9jry7jf/Anti_IP_Logger.txt/file
124,Gun Simulator SPAM KILL EVERYONE,https://www.mediafire.com/file/dlv9yuduxs9ikri/Gun_Sim_SPAM_KILL_EVERYONE.txt/file
125,The Supers GET ALL XP ORBS,https://www.mediafire.com/file/t2lugd6obt7ue06/The_Super_GET_ALL_XP_ORBS.txt/file
126,"Strasbourg KILL ALL, AA BYPASS, WALKSPEED & JUMP",https://www.mediafire.com/file/df98o6fig6u1fkk/Strasbourg_KILL_ALL_%2526_MORE%2521.txt/file
127,Knight Heroes AUTO COLLECT GEMS & COINS,https://www.mediafire.com/file/xu7q4ls1wn78eaf/Knight_Heroes_AUTO_COLLECT_GEMS_%2526_COINS.txt/file
128,Oretary GUI AUTO FARM CARGO LIFTER & MORE!,https://www.mediafire.com/file/4eerxkqsuns6z3u/Oretary_GUI_AUTO_FARM_CARGO_LIFTER_%2526_MORE%2521.txt/file
129,Genos Hub FREE [5 GAMES],https://www.mediafire.com/file/lj7cjn1kdm1l4nw/Genos_Hub.txt/file
130,"Rumble Quest AUTO DUNGEONS, AUTO SELL, AUTO STAT & MORE! [UPDATED]",https://www.mediafire.com/file/11mkdms807n0wbn/Rumble_Quest_AUTO_DUNGEONS%252C_AUTO_SELL_%2526_MORE%2521.txt/file
131,"Project XL GUI, AUTO FARM / QUEST, NO DASH COOLDOWN & MORE! 2021 [UPDATED]",https://www.mediafire.com/file/8z6wg8p1vsetmj9/Project_XL_GUI%252C_AUTO_FARM%252C_QUEST_%2526_MORE%2521_%255BUPDATED%255D.txt/file
132,Zombie Defense Tycoon INFINITE AMMO SCRIPT,https://www.mediafire.com/file/xgb90rcjn09r5jz/Zombie_Defense_Tycoon_INFINITE_AMMO_SCRIPT.txt/file
133,Demon Slayer: Burning Ashes DELETE ANTI EXPLOIT,https://www.mediafire.com/file/no55dg1vhzknexw/Demon_Slayer%253B_Burning_Ashes_DELETE_ANTI_EXPLOIT.txt/file
134,Battle Buddies DISABLE AI SPAWNING,https://www.mediafire.com/file/gutvbs1azvp0onc/Battle_Buddies_DISABLE_AI_SPAWNING.txt/file
135,Bloxymon HEAL ANYWHERE,https://www.mediafire.com/file/avwl2x2ho1j3uxq/Bloxymon_HEAL_ANYWHERE.txt/file
136,"AoT:Insertplayground KILL ALL, KILL TITANS, GOD MODE & MORE! [MARCH 2021]",https://www.mediafire.com/file/1oz39ow1ujjq2lq/AoT%253BInsertplayground_KILL_ALL%252C_KILL_TITANS%252C_GOD_MODE_%2526_MORE%2521.txt/file
137,HELL or HEAVEN Tycoon INFINITE MONEY,https://www.mediafire.com/file/2o21czczqz5wixk/HELL_or_HEAVEN_Tycoon_INFINITE_MONEY.txt/file
138,Sorcerer Fighting Sim GUI 2021,https://www.mediafire.com/file/fshywr85boexho7/Sorcerer_Fighting_Sim_GUI_2021.txt/file
139,A Hero’s Destiny AUTO TRAIN MARCH 2021,https://www.mediafire.com/file/u18rsueh72m3zlm/A_Hero%2527s_Destiny_AUTO_TRAIN_MARCH_2021.txt/file
140,Blocks! AUTO BUILD [BOAT & TINY ISLAND],https://www.mediafire.com/file/zgjdum936kzzhzn/Blocks%2521_AUTO_BUILD_%255BBOAT_%2526_TINY_ISLAND%255D.txt/file
141,Ori Hub FREE HUB [15+ GAMES],https://www.mediafire.com/file/bszori0cjmmmtnc/Ori_Hub_FREE_HUB_%255B15%252B_GAMES%255D.txt/file
142,Da Hood HOSPITAL FARM [OPEN SOURCE],https://www.mediafire.com/file/99fnlln8sxemykh/Da_Hood_HOSPITAL_FARM_%255BOPEN_SOURCE%255D.txt/file
143,REV PUBLIC AUTO FARM RACES [OPEN SOURCE],https://www.mediafire.com/file/jx2hgcf0hb6jtej/REV_PUBLIC_AUTO_FARM_RACES_%255BOPEN_SOURCE%255D.txt/file
144,Last Piece GLITCH ALL NPCS,https://www.mediafire.com/file/vxuttpd68a8ru2m/Last_Piece_GLITCH_ALL_NPCS.txt/file
145,Game Company Tycoon OP TROLL,https://www.mediafire.com/file/a7o60xl0yezkfs3/Game_Company_Tycoon_LOOP_CHANGE_OTHER_PLAYERS_CASH.txt/file
146,Blademaster Simulator AUTO FARM GUI MARCH 2021,https://www.mediafire.com/file/v23v5vxfernjqtv/Blademaster_Sim_AUTO_FARM_GUI.txt/file
147,Lumber Tycoon LUNA HUB EARLY RELEASE,https://www.mediafire.com/file/n1cihdrym6slefo/Lumber_Tycoon_LUNA_HUB_EARLY_RELEASE.txt/file
148,Blademaster Simulator AUTO BUY CRATES & AUTO FARM,https://www.mediafire.com/file/05w0zl3i16bsg6n/Blademaster_Sim_AUTO_BUY_CRATES_%2526_AUTO_FARM.txt/file
149,Cattoware FREE HUB [7+ GAMES],https://www.mediafire.com/file/mhczhodum9qgcg3/Cottoware_FREE_HUB_%255B7%252B_GAMES%255D.txt/file
150,The Mimic Chapter 2 INSTANTLY BEAT THE GAME,
151,Pet Swarm Simulator AUTO FOOD [OPEN SOURCE],https://www.mediafire.com/file/3l71f5r1mrab64s/Pet_Swarm_Sim_AUTO_FOOD_%255BOPEN_SOURCE%255D.txt/file
152,Tower of Hell INF DOUBLE JUMP & MORE! [OPEN SOURCE],https://www.mediafire.com/file/xomiwiz60hmvnwq/Tower_of_Hell_INF_DOUBLE_JUMP_%2526_MORE%2521_%255BOPEN_SOURCE%255D.txt/file
153,"Ronopoly BREAK GAME, WIN GAME & MORE!",https://www.mediafire.com/file/d97s23ikog8cvmi/Ronoply_BREAK_GAME%252C_WIN_GAME_%2526_MORE%2521.txt/file
154,AOT:Freedom Awaits KILL ALL TITANS,https://www.mediafire.com/file/k4q09a6zduta4j6/AOT%253BFreedom_Awaits_KILL_ALL_TITANS.txt/file
155,[FE] ANIMATION EDITOR GUI [UPDATED],https://www.mediafire.com/file/zkt6qifbjza6c7w/%255BFE%255D_ANIMATION_EDITOR_GUI.txt/file
156,Dino Tower Defence GUN SCRIPT,https://www.mediafire.com/file/79yz22i1b2bf8uk/Dino_Tower_Defence_GUN_SCRIPT.txt/file
157,[FE] CAR SCRIPT,https://www.mediafire.com/file/aydxr2a4wfq6a8x/%255BFE%255D_CAR_SCRIPT.txt/file
158,ANTI IP LOGGER SCRIPT MARCH 2021 [DONT GET IP LOGGED AGAIN!],https://www.mediafire.com/file/rrqsi40weze0hj4/ROBLOX_ANTI_IP_LOGGER_MARCH_2021.txt/file
159,A Bizarre Journey GUI [SERVER CRASHER],https://www.mediafire.com/file/m4k95w7r1nu0yen/A_Bizarre_Journey_GUI_%255BSERVER_CRASHER%255D.txt/file
160,"Knockout KILL ALL, AUTO LEVEL & MORE!",https://www.mediafire.com/file/da8rlwk5tj2nimg/Knockout_KILL_ALL%252C_AUTO_LEVEL%252C_FLY_%2526_MOVEMENT_SPEED.txt/file
161,Blocks! PLAY WALLS TO TRAP PEOPLE & DELETE ALL BUILDS,https://www.mediafire.com/file/c5m84iehti2fo52/Blocks%2521_PLAY_WALLS_TO_TRAP_PEOPLE_%2526_DELETE_ALL_BUILDS.txt/file
162,Bladers Revelations LEAKED ROBLOX GAME,https://www.mediafire.com/file/i2wchosl8z0k6kg/bladersRevelation.rbxl/file
163,Mad City INFINITE AMMO [OPEN SOURCE],https://www.mediafire.com/file/t2iey4c919g6yif/Mad_City_INFINITE_AMMO_%255BOPEN_SOURCE%255D.txt/file
164,Demolition COIN TP SCRIPT,https://www.mediafire.com/file/blofkxk8gs3d60v/Demolition_COIN_TP_SCRIPT.txt/file
165,Demon Tower Defense FREE SUMMONS,https://www.mediafire.com/file/na67l1egsp3zwkw/Demon_Tower_Defense_FREE_SUMMONS.txt/file
166,All Star Tower Defense ERWIN INFINITY BUFF SCRIPT & AUTO EXECUTE SCRIPT,https://www.mediafire.com/file/hu748aa6vgrwsmi/All_Star_Tower_Defense_4_OR_8_ERWIN_INFINITY_BUFF.txt/file
167,No-Scope Sniping GUN MODS [OPEN SOURCE],https://www.mediafire.com/file/c5yvdexf9g2o7xj/No-Scope_Sniping_GUN_MODS_%255BOPEN_SOURCE%255D.txt/file
168,brawl 2 KILL AURA & BLOCK INFINITELY,https://www.mediafire.com/file/21j486hiqa45ni6/brawl_2_KILL_AURA.txt/file
169,Dragon Ball Z Final Stand POWER METER ADJUSTER [OPEN SOURCE],https://www.mediafire.com/file/dy48mm1l5oq7waj/Dragon_Ball_Z%253B_Final_Stand_POWER_METER_ADJUSTER_%255BOPEN_SOURCE%255D.txt/file
170,Ultimate Driving: Westover Islands FREE $110K SCRIPT & SPEED SCRIPT,https://www.mediafire.com/file/ks1yo7s8z8qk83u/Ultimate_Driving%253B_Westover_Islands_SPEED_SCRIPT.txt/file
171,Brain Simulator AUTO FARM GUI MARCH 2021,https://www.mediafire.com/file/193fqae474ed1bm/Brain_Sim_AUTO_FARM_GUI_MARCH_2021.txt/file
172,JayHub 5 GAMES & UNIVERSAL,https://www.mediafire.com/file/uf3gn1u8k1le851/JayHub_FREE_SCRIPT_HUB_5_GAMES_%2526_UNIVERSAL.txt/file
173,Energy Assault UPDATED GUN MODS,https://www.mediafire.com/file/l3f0qz5bfj9cldi/Energy_Assault_UPDATED_GUN_MODS.txt/file
174,Transfur Infection 2 FREEZE FURRIES / PREVENT THEM FROM DOING ANYTHING,
175,Primordial Arts GOD MODE & AUTO FARM,https://www.mediafire.com/file/9ukwkr52lbi3sop/Primordial_Arts_GOD_MODE_%2526_AUTO_FARM.txt/file
176,Trading Simulator OP AUTO FARM,https://www.mediafire.com/file/yg24iymg5fv5zfo/Trading_Sim_OP_AUTO_FARM.txt/file
177,Ninja Legends AUTO FARM MARCH 2021,https://www.mediafire.com/file/27ut1ixcbssss8y/Ninja_Legends_AUTO_FARM_MARCH_2021.txt/file
178,Escape Mcdonalds Parkour Obby INSTANT FINISH & FREE BOOMBOX,https://www.mediafire.com/file/dpwfmar43sbj8nk/Escape_Mcdonalds_Parkour_Obby_INSTANT_FINISH.txt/file
179,Bacon Simulator AUTO FARM GUI MARCH 2021,https://www.mediafire.com/file/juhcuqlv4flz6q3/Bacon_Sim_AUTO_FARM_GUI_MARCH_2021.txt/file
180,Blade Quest AUTO FARM,https://www.mediafire.com/file/sgtikyv1kblo9il/Blade_Quest_AUTO_FARM.txt/file
181,Mstir Hub FREE [11 GAMES],https://www.mediafire.com/file/zlvfao7fronfifq/Mstir_Hub_FREE_%255B11_GAMES%255D.txt/file
182,King Piece AUTO RAID & MORE! [UPDATED],https://www.mediafire.com/file/i6hcd552pocyjim/King_Piece_AUTO_RAID_%2526_MORE%2521_%255BUPDATED%255D.txt/file
183,Project XL REDEEM ALL CODES [OPEN SOURCE],https://www.mediafire.com/file/smt8b4cbs33chwl/Project_XL_REDEEM_ALL_CODES_%255BOPEN_SOURCE%255D.txt/file
184,Rage Runner TELEPORT TO THE END,https://www.mediafire.com/file/8bgn6ech9xleeqq/RageRunnerTPToEnd.lua/file
185,ROBLOX CHAMS ESP [OPEN SOURCE] FREE,https://www.mediafire.com/file/nhjlt8det9ow0eb/ROBLOX_CHAMS_ESP_%255BOPEN_SOURCE%255D_FREE.txt/file
186,Knight Heroes INFINITE MONEY & DIAMONDS,https://www.mediafire.com/file/4qefq6cfemfdvio/Knight_Heroes_INFINITE_MONEY_%2526_DIAMONDS.txt/file
187,ROBLOX VIEW TRACERS ESP,https://www.mediafire.com/file/uzchv71atmciv29/ROBLOX_VIEW_TRACERS_ESP.txt/file
188,Dust: Wasteland Survival ADRASTEA GUI,https://www.mediafire.com/file/il7ana8pou2o43m/Dust%253B_Wasteland_Survival_ADRASTEA_GUI.txt/file
189,Dinosaur World Mobile V1.1 GUI,https://www.mediafire.com/file/34rur0bn12iiaji/Dinosaur_World_Mobile_V1.1_GUI.txt/file
0,POLYGUNS GUN MOD [OPEN SOURCE],https://www.mediafire.com/file/bkr15xg5crrtxw6/POLYGUNS_GUN_MOD_%255BOPEN_SOURCE%255D.txt/file
1,Blade Quest AUTO FARM UPDATED,https://www.mediafire.com/file/0ludpdf98016nbz/Blade_Quest_AUTO_FARM_%255BUPDATED%255D.txt/file
2,City Life Tycoon CASH FARM,https://www.mediafire.com/file/b8owefuo2ocgjor/City_Life_Tycoon_CASH_FARM.txt/file
3,"Gym Realm AUTO FARM GUI, BOSS FARM & MORE!",https://www.mediafire.com/file/4tr4ba5mai8ruzd/Gym_Realm_AUTO_FARM_GUI%252C_BOSS_FARM_%2526_MORE%2521.txt/file
4,Project XL MOST OP GUI? NEW MARCH 2021,https://www.mediafire.com/file/jvufqdcu8y8x9yt/Project_XL_MOST_OP_GUI_NEW_MARCH_2021.txt/file
5,Mine Inc. FAST MONEY FARM,https://www.mediafire.com/file/7b8rjy2xylxo811/Mine_Inc._FAST_MONEY_FARM.txt/file
6,"Elemental Legends GUI, AUTO TAP, AUTO SELL, COLLECT ALL COINS & AUTO HATCH",https://www.mediafire.com/file/fdelqf5enlggpdd/Elemental_Legends_GUI%252C_AUTO_TAP%252C_AUTO_SELL%252C_COLLECT_ALL_COINS_%2526_AUTO_HATCH.txt/file
7,Broken Bones V CASH & XP SCRIPT,https://www.mediafire.com/file/nnbsqi62gc83vwk/Broken_Bones_V_CASH_%2526_XP_SCRIPT.txt/file
8,Resurrection CONSOLE GUI,https://www.mediafire.com/file/1spkkt5odog9k1u/Resurrection_CONSOLE_GUI.txt/file
9,Sky Hub FREE HUB WITH 9 GAMES [OP],https://www.mediafire.com/file/zsl0yn77gsw2ox9/Sky_Hub_FREE_HUB_WITH_9_GAMES.txt/file
10,Electric State DarkRP AUTO FARM CROPS & AUTO SELL,https://www.mediafire.com/file/djjf5bz8f1xhyiy/Electric_State_DarkRP_AUTO_FARM_CROPS_%2526_AUTO_SELL.txt/file
11,Fairy Tail: Magic Brawl AUTO FARM GUI,https://www.mediafire.com/file/bo7j5vd9rgm78xw/Fairy_Tail%253B_Magic_Brawl_AUTO_FARM_GUI.txt/file
12,Build A Boat For Treasure AUTO FARM MARCH 2021,https://www.mediafire.com/file/0lmbxz9pzrjkfbu/Build_A_Boat_For_Treasure_AUTO_FARM_MARCH_2021.txt/file
13,Blox Wars GUI,https://www.mediafire.com/file/mkssdj8c96scf7f/Blox_Wars_GUI.txt/file
14,Escape to WIN Parkour Obby PERMANENT FINISH GAME,https://www.mediafire.com/file/rpxm7ojsvxgq7tc/Escape_to_WIN_Parkour_Obby_PERMANENT_FINISH_GAME.txt/file
15,Bizarre Uprising MONEY FARM & BRING BANK NOTES [OPEN SOURCE],https://www.mediafire.com/file/i6ew76xjulif9xs/Bizarre_Uprising_MONEY_FARM_%2526_BRING_BANK_NOTES_%255BOPEN_SOURCE%255D.txt/file
16,"Project XL REROLL BRAIN, USE BRAINS UNTIL YOU GET DESIRED CLASS [OPEN SOURCE]",https://www.mediafire.com/file/2cebcjzecjtkoae/Project_XL_REROLL_BRAIN%252C_USE_UNTIL_YOU_GET_DESIRED_CLASS.txt/file
17,PARKOUR INSTANT FINISH,https://www.mediafire.com/file/ad0xkghtlpb0l40/PARKOUR_INSTANT_FINISH.txt/file
18,"ROBLOX CHAT LOGGER MARCH 2021 [PRINT, WEBHOOKS]",https://www.mediafire.com/file/tks9bnrvzbt4wwy/ROBLOX_CHAT_LOGGER_MARCH_2021_%255BPRINT%252C_WEBHOOKS%255D.txt/file
19,SKYWARS GUI,https://www.mediafire.com/file/a14006rvp080ace/OPSkywarsGUI.lua/file
20,Anime Unlimited v.1a ALL CHARS FREE,https://www.mediafire.com/file/9y1twff6c106n3b/Anime_Unlimited_V.1a_ALL_CHARS_FREE.txt/file
21,"Field Trip Z GOD MODE, KILL ALL, GOD PLAYER & KILL PLAYER",https://www.mediafire.com/file/4np62uamk66hdhb/Field_Trip_Z_GOD_MODE%252C_KILL_ALL%252C_GOD_PLAYER_%2526_KILL_PLAYER.txt/file
22,DEAD AHEAD KILL ALL,https://www.mediafire.com/file/rmrv10qmz9su4xn/DEAD_AHEAD_KILL_ALL.txt/file
23,Parkour STAT EDITOR [OPEN SOURCE],https://www.mediafire.com/file/wz0m9x1z53bzu2i/Parkour_STAT_EDITOR_%255BOPEN_SOURCE%255D.txt/file
24,Rogue Lineage SCROLL ROULETTE BOT [UPDATED],https://www.mediafire.com/file/jydxp7m12gv9usd/Rogue_Lineage_SCROLL_ROULETTE_BOT_%255BUPDATED%255D.txt/file
25,Resurrection KILL ALL ZOMBIES,https://www.mediafire.com/file/htodidvng3fiorl/Resurrection_KILL_ALL_ZOMBIES.txt/file
26,Mall Tycoon AUTO BUY & CASH OUT,https://www.mediafire.com/file/8j96wmogkca21mk/Mall_Tycoon_AUTO_BUY_%2526_CASH_OUT.txt/file
27,steal time from others & be the best GUI & ANTI CHEAT BYPASS,https://www.mediafire.com/file/yex0ar61hs653l1/steal_time_from_others_%2526_be_the_best_GUI%252C_ANTI_CHEAT_BYPASS.txt/file
28,In Another Time ITEM FARM,https://www.mediafire.com/file/pjh38yr6kznoq0j/In_Another_Time_ITEM_FARM.txt/file
29,Anime Fighting Simulator CHIKARA FARM,https://www.mediafire.com/file/acrshayktb8aedb/Anime_Fighting_Sim_CHIKARA_FARM.txt/file
30,Driving Empire AUTO FARM MARCH 2021,https://www.mediafire.com/file/gkyvkbov473umt5/Driving_Empire_AUTO_FARM_MARCH_2021.txt/file
31,Psycho 100: Infinity GUI [OPEN SOURCE],https://www.mediafire.com/file/ugvz87ht40b29xd/Psycho_100%253B_Infinity_GUI_%255BOPEN_SOURCE%255D.txt/file
32,Munching Masters AUTO SELL & EAT,https://www.mediafire.com/file/lizrkl6ilhw14p4/Munching_Masters_AUTO_SELL_%2526_EAT.txt/file
33,Bloxburg AUTO FARM HAIRDRESSER [UNDETECTABLE] [OPEN SOURCE],https://www.mediafire.com/file/npbmrysb9131gvb/Bloxburg_AUTO_FARM_HAIRDRESSERS_OPEN_SOURCE.txt/file
34,Bee Swarm Simulator AUTO FARM & AUTO QUEST [OPEN SOURCE],https://www.mediafire.com/file/j93pr6uys6yf9ro/Bee_Swarm_Sim_AUTO_FARM%252C_AUTO_QUEST_%255BOPEN_SOURCE%255D.txt/file
35,ROBLOX SERVER CRASH [WORKS ON ALMOST ALL GAMES],https://www.mediafire.com/file/x6klpeda597j8da/ROBLOX_SERVER_CRASH_SCRIPT_MARCH_2021_.txt/file
36,Project XL ADJUSTABLE SKILL SPAMMER [OPEN SOURCE],https://www.mediafire.com/file/7hefd1dzszft5da/Project_XL_ADJUSTABLE_SKILL_SPAMMER_%255BOPEN_SOURCE%255D.txt/file
37,Tatakai Reborn TURN OFF STUPID MUSIC SCRIPT,https://www.mediafire.com/file/w50g0yu5ojztdyk/Tatakai_Reborn_TURN_OFF_STUPID_MUSIC_SCRIPT.txt/file
38,BLISS ESP HUB [UNIVERSAL],https://www.mediafire.com/file/uli4z70x74ogwm4/BLISS_ESP_HUB_%255BUNIVERSAL%255D.txt/file
39,Murder Mystery 2 GET FREE PUMPKIN PET & ALL HALLOWEEN EVENT SKINS,https://www.mediafire.com/file/zzx6xt2wtlyn70a/Murder_Mystery_2_HALLOWEEN_PET_%2526_SKINS.txt/file
40,Project XL v3.8 DELETE TRASH BAGS SCRIPT,https://www.mediafire.com/file/88o115ew1h3a5qk/Project_XL_v3.8_DELETE_TRASH_BAGS_SCRIPT.txt/file
41,"Jailbreak PARAGON, SEMI GOD, WEAPON MODS & MORE!",https://www.mediafire.com/file/xsmtsbmo8oir7a8/Jailbreak_PARAGON.txt/file
42,Funky Friday AUTO PLAYER [MODIFIED],https://www.mediafire.com/file/rv1pdo1hrptk7fl/Funky_Friday_AUTO_PLAYER_%255BMODIFIED%255D.txt/file
43,KILL ALL FOR GAMES THAT USE CARBON ENGINE,https://www.mediafire.com/file/fjk6479nbnngm00/KILL_ALL_FOR_GAMES_THAT_USE_CARBON_ENGINE.txt/file
44,Blade Quest AUTO FARM MARCH 2021 [NEW],https://www.mediafire.com/file/ki0oq5ceq0skmdb/Blade_Quest_AUTO_FARM_MARCH_2021.txt/file
45,KILL ALL FOR ANY GAME THAT USES ACS ENGINE,https://www.mediafire.com/file/wx8tjo2dgn9zzjc/KILL_ALL_FOR_GAMES_THAT_USE_ACS_ENGINE.txt/file
46,steal time from others & be the best REACH SCRIPT,https://www.mediafire.com/file/ya924j66zihpxs2/steal_time_from_others_%2526_be_the_best_REACH_SCRIPT.txt/file
47,Phantom Forces NADE ESP,https://www.mediafire.com/file/g2jxyecz99h7s6s/Phantom_Forces_NADE_ESP.txt/file
48,Dust: Wasteland Survival GUI MARCH 2021,https://www.mediafire.com/file/mo6wbw0d59hkgbh/Dust%253B_Wasteland_Survival_GUI_MARCH_2021.txt/file
49,Pain SILENT AIM,https://www.mediafire.com/file/gyo6scjavj78aww/Pain_SILENT_AIM.txt/file
50,Anime Unlimited v.1b PRESTIGE SCRIPT,https://www.mediafire.com/file/ktfis95lywinq32/Anime_Unlimited_PRESTIGE_SCRIPT.txt/file
51,Anime Mania AUTO PLAY / AUTO FARM [SEMI AUTOMATED],https://www.mediafire.com/file/urm54jtuc2yozvt/Anime_Mania_AUTO_PLAY%252C_AUTO_FARM_%255BSEMI_AUTOMATED%255D.txt/file
52,Dynasty: Battlegrounds INFINITE ENERGY,https://www.mediafire.com/file/5y3yr7cw0ft87q4/Dynasty%253B_Battlegrounds_INFINITE_ENERGY.txt/file
53,SKYWARS FREE MEGA VIP ITEMS,https://www.mediafire.com/file/qllv6g6qvwhwwdp/SKYWARS_FREE_MEGA_VIP_ITEMS.txt/file
54,Counter Blox CUSTOM SKIN CHANGER [UNFINISHED],https://www.mediafire.com/file/hs3tfq1thtpjlzw/Counter_Blox_CUSTOM_SKIN_CHANGER_%255BUNFINISHED%255D.txt/file
55,Among Us Zombies INFINITE STATS,https://www.mediafire.com/file/bmbyqljm8ow68ue/Among_Us_ZOMBIES_INFINITE_STATS.txt/file
56,KRAKEN HUB CRACKED,https://www.mediafire.com/file/d0wo01ar6bscqly/KRAKEN_HUB_CRACKED.txt/file
57,Department Store PICKUP EVERYTHING SCRIPT,https://www.mediafire.com/file/3w81axakxkqti5p/Target_Department_Store_PICKUP_EVERYTHING.txt/file
58,"The Streets CIAZWARE, 60+ COMMANDS, INSTANT FE KILL & MORE!",https://www.mediafire.com/file/0qg9eq0ji7ggypa/The_Streets_CIAZWARE%252C_60%252B_COMMANDS%252C_INSTANT_FE_KILL_%2526_MORE%2521.txt/file
59,Trade Tower CASE OPENER SCRIPT,https://www.mediafire.com/file/etbgvoppa5udnm6/Trade_Tower_CASE_OPENER.txt/file
60,Project XL SERVERHOP FOR ITEMS,https://www.mediafire.com/file/2xa3ip6u46gvcz7/Project_XL_SERVERHOP_FOR_ITEMS.txt/file
61,Ro-Ghoul AIMBOT,https://www.mediafire.com/file/wbl49gl8otuwimy/Ro-Ghoul_AIMBOT.txt/file
62,Snowball.io GOD MODE,https://www.mediafire.com/file/zdev90uu02tvy63/Snowball.io_GOD_MODE.txt/file
63,town GOD MODE,https://www.mediafire.com/file/qlh4e8a3nlli2nr/town_GOD_MODE.txt/file
64,Zero Two Dance INSTANT KICK PLAYERS GUI,https://www.mediafire.com/file/izim3qu0xb0888j/Zero_Two_Dance_INSTANT_KICK_PLAYERS_GUI.txt/file
65,"Psycho 100: Infinity AUTO FARM, AUTO COLLECT CHESTS & MORE!",https://www.mediafire.com/file/gz2ncp9938j6655/Psycho_100%253B_Infinity_AUTO_FARM%252C_AUTO_COLLECT_CHESTS_%2526_MORE%2521.txt/file
66,Project XL YERPEQ HUB AUTO FARM & MORE!,https://www.mediafire.com/file/3dot9g9surf82yk/Project_XL_YERPEQ_HUB_AUTO_FARM_%2526_MORE%2521.txt/file
67,Anime Unlimited v.2a GUI [OPEN SOURCE],https://www.mediafire.com/file/qgv9m5xbp8cqr8t/Anime_Unlimited_v.2a_GUI_%255BOPEN_SOURCE%255D.txt/file
68,Rogue Lineage SCROLL ROULETTE BOT V3,https://www.mediafire.com/file/35b24pp7v1wscnn/Rogue_Lineage_SCROLL_ROULETTE_BOT_V3.txt/file
69,Totally Accurate Gun Simulator SPAM KILL EVERYONE,https://www.mediafire.com/file/hfdws1m7kcna213/Totally_Accurate_Gun_Sim_SPAM_KILL_EVERYONE.txt/file
70,"Eat Sand GUI GET LAVA, AUTO FARM & MORE!",https://www.mediafire.com/file/tftzy2pnzn7tyzz/Eat_Sand_GUI_GET_LAVA%252C_AUTO_FARM_%2526_MORE%2521.txt/file
71,"Glue Piece AUTO FARM GUI, DF TELEPORT [OPEN SOURCE]",https://www.mediafire.com/file/vfr8ohb5v07kq7b/Glue_Piece_AUTO_FARM_GUI%252C_DF_TELEPORT_%255BOPEN_SOURCE%255D.txt/file
72,Energy Assault KILL ALL [OPEN SOURCE],https://www.mediafire.com/file/onel8i51mwmbtbr/Energy_Assault_KILL_ALL_%255BOPEN_SOURCE%255D.txt/file
73,Bee Sim FLIGHT SPEED,https://www.mediafire.com/file/n7hdq7lqffg2hwc/Bee_Sim_FLIGHT_SPEED.txt/file
74,Grand Piece Online FASTER HITS & AUTO PERFECT BLOCK [OPEN SOURCE MOSTLY],https://www.mediafire.com/file/clpvz7iyasek6bd/Grand_Piece_Online_FASTER_HITS_%2526_AUTO_PERFECT_BLOCK_%255BOPEN_SOURCE%255D.txt/file
75,"Funky Friday AUTO PLAYER, ACCURACY PERCENTAGES & RELEASE DELAY [OPEN SOURCE]",https://www.mediafire.com/file/v1mc1655zvd57co/Funky_Friday_AUTO_PLAYER%252C_ACCURACY_PERCENTAGES_%2526_RELEASES_DELAY_%255BOPEN_SOURCE%255D.txt/file
76,"Sorcerer Fighting Sim AUTO FARM, AUTO UPGRADE",https://www.mediafire.com/file/u8t179nri79h7rl/Sorcerer_Fighting_Sim_AUTO_FARM%252C_AUTO_UPGRADE.txt/file
77,Blade Quest INSTA KILL,https://www.mediafire.com/file/70ir3xo36f3v7xx/Blade_Quest_INSTA_KILL.txt/file
78,Bloxburg AUTO FARM HAIRDRESSERS [OPEN SOURCE] 20TH MARCH 2021,https://www.mediafire.com/file/ak9p1uvsstb4p77/Bloxburg_AUTO_FARM_HAIRDRESSERS_%255BOPEN_SOURCE%255D_20TH_MARCH_2021.txt/file
79,World Zero KILL AURA [OPEN SOURCE],https://www.mediafire.com/file/tz568r06n8d84hd/World_Zero_KILL_AURA_%255BOPEN_SOURCE%255D.txt/file
80,Bee Sim AUTO FARM GUI MARCH 2021,https://www.mediafire.com/file/3c2sgyp061g1n8l/Bee_Sim_AUTO_FARM.txt/file
81,Bloxburg HAIRDRESSER & BLOXY BURGER CASHIER AUTO FARM [OPEN FARM],https://www.mediafire.com/file/g07p5yimxx4bz3t/Bloxburg_HAIRDRESSER_%2526_BLOXY_BURGER_CASHIER_AUTO_FARM_%255BOPEN_SOURCE%255D.txt/file
82,stay alive and flex your time on others FIGHT BOT,https://www.mediafire.com/file/9uqz2srmscnlqg7/stay_alive_and_flex_your_time_on_others_FIGHT_BOT.txt/file
83,Tatakai Reborn AUTO FARM GUI MARCH 2021,https://www.mediafire.com/file/zw7gk3k0h7qd23m/Tatakai_Reborn_AUTO_FARM_GUI_MARCH_2021.txt/file
84,SCP rBreach GUI MARCH 2021,https://www.mediafire.com/file/nq9ytvvjhyqzu0r/SCP_rBreach_GUI_MARCH_2021.txt/file
85,"CRY 4.6, THE BEST FREE TRADE BOT [FREE]",https://cdn.discordapp.com/attachments/771439463326023731/821060187837169715/HaveFun.zip
86,Project XL MOST OP GUI! [UPDATED] MARCH 2021,https://www.mediafire.com/file/r4nlcpmbw163thv/Project_XL_MOST_OP_GUI%2521_%255BUPDATED%255D_MARCH_2021.txt/file
87,Psycho 100: Infinity AUTO FARM,https://www.mediafire.com/file/l0sroq6kobdla0m/Psycho_100%253B_Infinity_AUTO_FARM.txt/file
88,Psycho 100: Infinity AUTO FARM & AUTO QUEST MARCH 2021,https://www.mediafire.com/file/lm5f2s6pvi02kh9/Psycho_100%253B_Infinity_AUTO_FARM_%2526_AUTO_QUEST_MARCH_2021.txt/file
89,Cattoware FREE HUB [17+ GAMES AND COUNTING] [UPDATED],https://www.mediafire.com/file/pa74qdtckii2hvo/Cattoware_FREE_HUB_%255B17%252B_GAMES_AND_COUNTING%255D_%255BUPDATES%255D%2523.txt/file
90,"Parkour AUTO FARM, ALWAYS FLOW, MAXED COMBO & MORE! [OPEN SOURCE]",https://www.mediafire.com/file/z2yev8p79ef6mf8/Parkour_AUTO_FARM%252C_ALWAYS_FLOW%252C_MAXED_COMBO_%2526_MORE%2521_%255BOPEN_SOURCE%255D.txt/file
91,Blade Quest KILL AURA & NO SWORD COOLDOWN,https://www.mediafire.com/file/yidt5mejr47droa/Blade_Quest_KILL_AURA_%2526_NO_SWORD_COOLDOWN.txt/file
92,Murder Mystery 2 UTILITIES FREE GUI,https://www.mediafire.com/file/g2egfhtiow6psmf/Murder_Mystery_2_UTILITIES_FREE_GUI.txt/file
93,Tower Blitz AUTO FARM TOKENS,https://www.mediafire.com/file/44vkadccp7iaw32/Tower_Blitz_AUTO_FARM_TOKENS.txt/file
94,Blade Quest KILL ALL MOBS,https://www.mediafire.com/file/ul7l94qbvj79bae/Blade_Quest_KILL_ALL_MOBS.txt/file
